y,X
Business,Steel Shares Dive On Price Cuts
Sci/Tech,Macromedia launches Flex Builder
Sports,Roundup: Kupets and Hatch golden in gymnastics
Sports,Gold slips out of reach
Sports,Davenport remains on title streak
Sports,Angels pass Yankee test
World,Fierce Battles for Control of Holy City
World,Four US soldiers face hearing in Germany over Iraq prisoner abuse
Business,BMO to lead off banks #39; quarterly results reports
Business,UPDATE: Woolworths Profit Up 12; CEO Departure Delayed
Business,Abbey Staff to Learn Scale of Takeover Job Cuts
Sci/Tech,Macromedia launches Flex Builder
Sci/Tech,Flying the Sun to Safety
Sci/Tech,Report: Global LCD oversupply to peak in 3Q
Sports,US sprinter Gatlin hangs on to beat a blazingly fast field
Sports,IOC strips gold medal from Russian shot putter
Sports,Report: Colorado hit by grand jury indictment
World,Four US soldiers in Abu Ghraib prisoner scandal face pretrial &lt;b&gt;...&lt;/b&gt;
World,Kabul bounty hunter trial resumes
Sports,NFL Pass-Interference Crackwon Draws Fire (AP)
Sports,Baseball Today (AP)
Sports,Olympics-Sprinters Serve Up Greatest Race on Earth
Business,Philips Leads Europe Shares Up; ARM Down
World,Fighting Erupts Round Rebel-Held Najaf Shrine
Sports,Amazing race
Sports,Fastest man in world has great company
Sports,Drought ends with reign
Sports,Angels complete sweep of Yankees
Sports,California overpowers N. Carolina
Sports,Bonds powers Giants
Sports,NL notables
Sports,Ortiz is cleaning up his act
Sports,Report: Idled Garciaparra will have MRI on Achilles #146;
Sports,Whitewashing
Sports,Fundamental problems
Sports,It #146;s a choice performance
Business,This house has everything.
Business,"After shakeout, medical websites find new health"
Business,"Despite travel slump, online firms flourish"
Business,"To installers of car stereos, auto systems sound fishy"
Business,Back to school with gadgets galore
Business,Numbers in dispute as OT rules kick in
Business,Rosy forecasts slipping as oil prices rise
Business,"Music stores lack excitement, executive says"
Business,Doctors online
World,Two Munch paintings taken in museum heist
World,Talks drag as fighting shakes Najaf
World,"At checkpoint, US forces kill 3 Afghan civilians"
Sci/Tech,BEA packages Web application tools
Business,"UK Stocks Advance, Paced by British Airways and Rentokil"
Business,Australia #39;s Virgin Blue increases fuel surcharge after oil hikes
Business,"Abbey staff loss will be  quot;under 4,500 quot;"
Sports,"Fastest race ever yields gold, bronze for US"
Sports,"American charges late, earns surprise bronze"
Sports,Shot put winner stripped of gold
Sports,An American gymnast #39;s Hamm-handed move
Sports,"Fish founders late, settles for silver"
World,Aide to Carl the Jackal Acquitted (AP)
World,Electricity Goes Off Across Bahrain (AP)
World,Singapore wants to double manufacturing in 15 years
World,Pakistan reveals al-Qaeda plot
World,Experts defuse bomb in Thailand #39;s violence-hit south
World,DoCoMo in Motorola 3G talks
World,Weather gets 3D gaming makeover
World,Exorcist movie thrills box office
Sci/Tech,DoCoMo and Motorola in talks
Sci/Tech,Arm Holdings buys US tech firm
Business,Billabong sees big swell
Business,"BHP, Alcoa plan \$138m JV sale"
Business,INTERVIEW: Australia #39;s Evans  amp; Tate Aims For 10 Growth
Sports, #39;Give Gunners silverware #39;
Sports,Hemingway nabs silver in high jump
Sports,Jaguars give Brackens his release
Sports,Puyallup #39;s Moore takes US Amateur
Sports,No slipups this time as Timlin holds his own
Sports,Gaining dad #39;s support of Miranda #39;s sport was her biggest takedown
Business,New overtime rules are mostly bad news for employees
Sports,Radcliffe Will Go to Beijing - Bedford
Sports,Surprise Greek winner in 20km walk
Sports,Itsa losing proposition
World,Fierce battles for Najaf
World,Chechen police seize 7 rebels
Business,Philips Leads Europe Shares Up; ARM Down (Reuters)
Sports,Out without a bang: Cannons falter in final
Sports,Ulmer tracks down world record
Sports,Biffle thwarts Martin #146;s gamble for 2d triumph
Sports,Vargas valiant in loss
Sports,"Hardware in store for Hatch, Kupets"
Sports,"Hey, just who is this guy?"
Sports,Hemingway has silver sense
Sports,They #146;re in the wrong
Sports,"Devers can #146;t outrun pain, falls in hurdles"
Sports,"Fish founders late, settles for silver"
Sports,Play of US women pleasing to the eye
Sports,Jarno looking to reverse recent form
Sports,Jarno takes in the Olympics
Business,"Oil Retreats, Lifts Asian Stocks"
Business,UPDATE: Australia #39;s Fortescue Signs China Railway Group
Sci/Tech,Thin-client desktops: Not defunct yet
Sci/Tech,Digital media -- knowing your rights
Sports,Final day brings out big crowd
Sports,Soldier shot dead at biking venue
World,Kidnapped Reporter Released In Iraq
World,Muslim group claims Jewish Paris attack
World,Premiers differ on air security plan
Sci/Tech,The Shame of Adult Male Virginity
Business,ARM buys US tech firm Artisan
Business,INTERVIEW: Australia #39;s Billabong On Acquisition Trail
Sports,Franchitti captures Pikes Peak
Sports,Soldier shot dead at Olympics
Sports,Heart-breaking loss for Tall Blacks
World,25 dead in Venezuelan military plane crash
World,Abu Ghraib hearings begin in Germany
Sports,Greece Goes Crazy Over 'Immortal' Walker
Business,"ADV: \$150,000 Mortgage for Under \$690/Month"
World,China confirms bird flu found in pigs last year (AFP)
World,Kenya Maasai land tensions grow
World,Ordeal of 'Deserters' Who Didn't Desert
Business,Productivity Growth Slows to 1.8 Percent
Business,"Referendum confirmed, Chvez looks ahead"
Business,Truckers #39; Strike Enters Third Day
Business,UPDATE: Singapore Tiger Airways To Start Flights In Sep
Sci/Tech,Is Real a Real Hypocrite?
Sports,Koorzhanenko kicked out of Olympics
Sports,Henry: Record not enough
Sports,Idowu put out by judge blunder
Sports,Tall Blacks quarterfinal hopes dashed
Sports,Sand dreams crumble in quarter-finals
Sports,Angels wouldn #39;t be a good playoff foe
Sports,Bonds hits No. 693 in Giants #39; win
World,"Obasanjo warns Sudan on militia, calls for AU peacekeepers"
World,India News: Iran nuclear power to become operational in 2006
Sports,News and notes
Sci/Tech,A Site for Banner Ad Freaks
Sci/Tech,Is Real a Real Hypocrite?
Sci/Tech,Army: JetBlue Data Use Was Legal
Sci/Tech,Politicos Dig Deep for Your Data
Sci/Tech,Scientists Breed a Tougher Mouse
Business,"Colgate to Cut Work Force, Close Plants"
Sci/Tech,Mars Probes to Yell 'Geronimo!'
Sci/Tech,Electricity Revives Coral Reef
Sci/Tech,Catching Meth Cooks Pink-Handed
Sci/Tech,Satirists Skewer U.S. Candidates
World,Taiwan Lawmakers Pass Sweeping Legislative (AP)
World,Prisoner Abuse Suspect Faces German Court
World,Felix Leads Three U.S. Women in 200-Meter
Business,"Tower of gas fire diminshes, but worried evacuees can stay in &lt;b&gt;...&lt;/b&gt;"
Business,The Call Is Cheap. The Wiretap Is Extra.
Sci/Tech,P2P Networks Not Responsible for Copyright
Sci/Tech,VoIP Vs. Conventional Telephones
Sci/Tech,Long-distance Web surfing comes closer
Sports,Franchitti adds another win
World,Malaysia says clear of human bird flu cases
World,Arroyo stays 4 economic secretaries in new Cabinet
Business,Chain Store Sales Slip in Latest Week (Reuters)
Business,Volkswagen Says It Will Not Increase Wages
Business,Boom in house prices is  #39;well and truly over #39;
Sci/Tech,Software Companies Not Liable for Copyright Infringement
Sports,"SWEAT AND TEARS Devers, Radcliffe can #39;t finish; Kastor overjoyed &lt;b&gt;...&lt;/b&gt;"
Sports,Gymnastics #39; pettiness is all-around
Sports,"For Cink, NEC Title Comes by 4 Strokes"
World,Guantanamo Hearings To Give Only Restricted View Of Bin Laden &lt;b&gt;...&lt;/b&gt;
Sports,More tests for exhausted Radcliffe
Business,J J Report Lifts Guidant Shares (Reuters)
Business,Singapore Budget Carrier Set to Take Off
World, #39;Jackal aide #39; in case 2 acquittal
World,Sudan negotiator denies need for AU peacekeepers in Darfur (AFP)
Sci/Tech,Big gains for Krishnamurthi (SiliconValley.com)
Business,Area Job Growth Outpaces Nation's
Business,"After 38 Years, Valenti Prepares To Move On"
Business,A Curved Path for an Innovative Museum
World,'Mercenaries' coup trial begins
World,Farc rebels reject hostage offer
Sports,"Despite judging error, Hamm #39;s gold medal shows no tarnish"
Sports,Sturrock leaves Southampton
Sports,Women #39;s event has brighter future
Sports,Henry: Its Winning Things That Matters
Sports,NL: Tempers flare in Cubs #39; win
Business,Stock Futures Rise as Oil Prices Ease (Reuters)
World,Britain's Straw to Keep World Pressure on Sudan (Reuters)
Business,Stock Futures Rise as Oil Prices Ease
Sports,Tsoumeleka Wins Greece's First Track Gold
Business,Stocks to Watch on August 23
Sports,A.L. Wrap: Molina Leads Angels to Sweep of Yankees
World,Fighting Erupts Around Rebel-Held Iraqi Shrine
World,Israel Plans 530 New Settler Homes in W.Bank-Sources
World,"Angels Beat Yanks, Bosox Closer in AL EAST"
World,Israel OKs More West Bank Settlement Homes
World,Norway Searches for Treasured Masterpieces
Business,Election monitors work to build nations #39; trust
Business,Group: Google governance flawed
Business,Hometrack survey reveals falling house prices
Sci/Tech,Travelers could soon report to work mid-flight
Sci/Tech,Macromedia Bolsters Flex with New Development Environment
Sports,Canuck player injured
Sports,Sports: Red Sox 6 White Sox 5
World,Taiwan shrugs off Singaporean leader #39;s criticism of the island #39;s &lt;b&gt;...&lt;/b&gt;
Sci/Tech,Google Not The First  To Go Dutch
Sci/Tech,ManTech to Aid Air Force Network
Sci/Tech,Unanet's Software Lets Managers Watch Work in Progress
Sci/Tech,Human chips more than skin-deep
Business,Google Wins Fans With IPO Gains
Sports,Gatlin Turns Sprinting Into Art
Sports,Fiesty Cubs Take Series
World,Britain #39;s Straw leaves for Sudan
Sci/Tech,New Fat-Busting Microwave Oven Unveiled (Reuters)
Sports,"Spain, Lithuania Go 5-0 in Men's Hoops (AP)"
World,Straw leaves for Darfur visit (AFP)
Business,KMart to Sell 18 Stores to Home Depot (Reuters)
World,Bahrain boils in summer power cut
Business,UPDATE:Philippine Officials Play Dn Arroyo Crisis Remark
Business,Singer  amp; Friedlander First-Half Net Slips 9 on Costs (Update3)
Business,Country House Market Stages Recovery
Business,"Dollar Bounces; Eye on Data, Greenspan"
Business,Medarex to Start Phase III Trial
Business,"Alcoa, BHP Billiton to sell shares in Integris Metals IPO"
Sci/Tech,Morpheus claims landmark P2P legal victory
Sports,"Felix, Two Other US Women Advance in 200"
Sports,Police cadet faces charges in shooting death of soldier
Sports,Monty would be Lee #39;s wild man
World,British FM leaves for Darfur visit (AFP)
Sports,Atalanta fires coach
World,Impoverished families of Nepal hostages in Iraq desperate for details (AFP)
Business,EDS picks Siebel as its preferred CRM vendor
Business,Indian state-owned banks brace for a strike over pay
Business,UK #39;s Glaxo Says Wins Against Teva
Sports,GB team: Radcliffe wasn #39;t injured
World,Rebels Urged to Give Up Shrine
Sci/Tech,Transmeta bets on LongRun2
Sci/Tech,TSMC files another patent suit against SMIC
Sports,Unhappy Holiday for Cal
Sci/Tech,E-Vote Machine Certification Process Criticized
Business,AUSTRALIA: Woolworths posts higher H2 profit
Business,Asian Stocks Rise as Oil Drops From Record; Honda Leads Advance
Sci/Tech,Pope condemns human cloning
Sci/Tech,Consumers Say Apple Should Share
World,Sudan denies need for AU peacekeepers in Darfur
World,Volkswagen Says 'No Room' for Wage Hikes (AP)
Business,Before-the-Bell: FedEx Up After Outlook (Reuters)
World,al-Qaida Tip Boosts Security in Honduras (AP)
Sports,Gatlin Turns Sprinting Into Art
Sports,Drama Queen Khorkina Sulks Into Retirement
Sci/Tech,iPod is the only clear winner?
Sports,"Soccer: We're No Symbol of Freedom, Iraq Coach Says"
Business,Before-the-Bell: FedEx Up After Outlook
Sports,Tsoumeleka Wins Greece's First Athletics Gold
Sports,Tennis: Chilean Alchemists Turn Dreams Into Gold
Sci/Tech,Nvidia to power next Sony console
Business,Pay-Per-View Revenue Boosts WWE Profit
Sports,Gatlin Beats Fastest-Ever 100M Field (AP)
Sci/Tech,IBM Targets Web Hosting as Key Growth Area (Reuters)
Sci/Tech,"Glaciers Shrink, But Some Resist Global Warming (Reuters)"
World,"Plan would split CIA, cut Pentagon control (Chicago Tribune)"
Sci/Tech,Musician #39;s Group Questions Pew Survey
World,Britain's Straw to Keep World Pressure on Sudan
Sports,"American Hits Wrong Target, Loses Gold Medal"
World,Afghanistan's Karzai in Pakistan for Terror Talks
Sports,N.L. Wrap: Ramirez Lifts Cubs Over the Astros
World,Iran Says Iraqi Government Risks Losing Support
World,Anxious Bangladesh Braces for More Protests
World,Bodies of WWI Austrian Soldiers Found in Glacier
Sci/Tech,Columbia disaster still haunts Nasa officials
World,Fatal blast rocks Turkish resort
Business,ARM to Buy Artisan Components for About \$913 Million (Update6)
Business,Oil Holds at \$47 as Iraq Resumes Exports
Business,KMart to Sell 18 Stores to Home Depot
Business,Choose  #39;The Apprentice #39;
Business,Southwest to cut 88 flights in October
Sci/Tech,TSMC files another patent suit against SMIC
Sports,Radcliffe  #39;was not injured #39;
Sports,Lithuania wraps up with 100-85 win over Australia
World,Chechens Mark Birthday Of Slain Leader Ahead Of Election
World,"Woman Moves in With 6,000 Scorpions"
Sci/Tech,Saving Room for Dessert May Help Dieters
Business,"FedEx Hikes Profit Forecast, Cites Demand"
Business,WHO Urges ASEAN to Curb Tobacco Trade
Sci/Tech,"On the Web, Branding Is Back"
Sports,Graham finally admits he #39;s coach who turned in THG syringe
World,Britain #39;s Straw to Keep World Pressure on Sudan
World,Israel plans 530 settler homes
World,"North Korea: Tyrant is Bush, not Kim"
World,Afghan president arrives in Pakistan
Sci/Tech,Leader: Has Lycos empowered the spammers?
Business,Wal-Mart Lowers August Sales Forecast (AP)
Business,Before-the-Bell: Wal-Mart Edges Lower
World,Yukos cuts 2004 oil production forecast (AFP)
World,Talks begin in Abuja on conflict in Sudan's Darfur region (AFP)
Business,GM Recalling Aveo Cars for Safety Belt Fix
Business,HBOS calls for bank tie-up probe
Sci/Tech,Fujitsu and Cisco Form Strategic Alliance for advanced Internet &lt;b&gt;...&lt;/b&gt;
Sci/Tech,"ECM wares seize control of records creation, management"
Sci/Tech,Transmeta bets on LongRun2
Sci/Tech,"EDS, Siebel partner for tailored business packages"
Sci/Tech,BEA readies app server package for ISVs
Business,Artisan Rallies on Buyout
Business,"Dollar gains, bonds sink"
Business,Yukos plunges on fears of asset sales
Business,Drug Approvals Spark Mylan Labs
Sci/Tech,You can make calls on your PC
Sci/Tech,AMD uses strained silicon on 90-nanometer chips
Sports,Gatlin #39;s gun fastest in historic shootout
Sports,Everton board meeting postponed
Business,Toys R Us Posts Second-Quarter Profit (Reuters)
World,"Sudan's rebels, government gather for talks on Darfur crisis (Canadian Press)"
Business,Toys R Us Posts Second-Quarter Profit
Business,"Federal Express Hikes Profit Forecast, Cites Demand"
Sci/Tech,'Ordinary names' to go into space
Business,Wal-Mart Lowers August Sales Forecast
Business,"FedEx raises first quarter, full-year outlook"
Business,Stocks to Watch on August 23
Business,HBOS to complain over SCH Abbey bid
Business,"Transporters stir: ESMA invoked in Delhi, Gujarat"
Business,"Alcoa-Billiton venture, Integris Metals, to go public"
Business,Retail sales climb 0.2
Sci/Tech,"Ready for Service Pack 2? Not so fast, XP Pro users"
Sci/Tech,DNA technique protects against  #39;evil #39; emails
Sci/Tech,Online sales pass the \$15bn mark in the US
Sports,Russian gold medal winner tests positive
Sports,"Wood, Baker tossed in win over Houston"
World,Straw to demand more from Sudan
World,Volkswagen Says  #39;No Room #39; for Wage Hikes
World,Germany Acquits Carlos the Jackal Aide
Sports,Dream Team Breezes Past Angola 89-53 (AP)
Business,Toys 'R' Us Swings to 2Q Profit (AP)
World,Equatorial Guinea prosecutor wants death for S. African 'mercenary' (AFP)
Business,Wall Street Set to Open Slightly Higher
World,"Israel Plans 530 Settler Homes, with U.S. Nod"
World,Blast in Turkish Resort City Kills One
World,Sex Scandal Rocks Hong Kong Politics
World,Mother of Dead UK Soldier to Sue Government
World,Radcliffe baffled by failure
Business,Kreme-Filled Earnings
Sports,Investigators Find Steroids
Business,"Kmart Delivers, Bad News for Bears"
Business,Wal-Mart lowers August sales forecast
Business,Toys  #39;R #39; Us Swings to 2Q Profit
Business,ARM shares tumble on deal for chip firm
Business,Kerry attacks Bush overtime changes
Business,S amp;P revises outlook for India #39;s currency rating
Sci/Tech,Tekelec to acquire Steleus
Sports,"South Korean gymnast appealing judging error, Hamm hopes to hang &lt;b&gt;...&lt;/b&gt;"
Sports,UK has Plan B for power forward
World, #39;Why the Bombings? #39; Ask Bangladesh Protesters
World,Sex Scandal Rocks Hong Kong Politics
Business,Wal-Mart Says August Sales May Be Little Changed (Update4)
Business,KMart to Sell 18 Stores to Home Depot
Business,Stocks Post Early Gains As Oil Is Steady
Sci/Tech,"Siebel, EDS Ink BPO Deal"
World,Sudan Rejects Africa Troop Offer at Darfur Talks (Reuters)
World,Ryu ends Chinese domination
Business,"FedEx Raises Forecast, Stock Climbs"
World,Northern Cyprus trade ban lifted
Business,Stocks Open Slightly Higher as Oil Eases
Business,Toys R us Posts Net Profit
Business,Southwest Airlines to Cut 88 Flights
Sports,"Basketball: U.S. Men Cruise Past Angola, 89-53"
Sports,Olympics: Greece Gets Instant New 'Immortal'
Sports,Owen Seeks New Challenge at Real Madrid
Sports,2006 Olympic Torch Relay Unveiled (AP)
Sci/Tech,Scientists Say Risk of Water Wars Rising (Reuters)
Business,Audit of Venezuelan vote backs Chavez
Business,Columnist quits over plagiarism
Sci/Tech,File-sharing software off legal hook
Sci/Tech,Western Drought Is Grounding Boaters
Sports,Elber blow for Lyon
World,Sudanese peace talks open
World,Afghanistan #39;s Karzai in Pakistan for terror talks
Sci/Tech,Google Yields More Than Fistful of Dollars
Business,Treasuries Lower in Data Vacuum (Reuters)
Business,Cartel inquiry claims Amcor chief
Sci/Tech,Mission Fantastic to Mars -- Part 1
Business,Treasuries Lower in Data Vacuum
World,Sudan Rejects Africa Troop Offer at Darfur Talks
Business,YUKOS Cuts 2004 Forecast by 4.5 Percent
World,Nepal Opposition Calls for Truce to End Blockade
Sci/Tech,Postal Service seals big SAP deal
Business,Wal-Mart Lowers August Sales Forecast
Sci/Tech,ARM to buy designer of systems-on-a-chip
World,Norway Searches for Treasured Masterpieces
World,Abu Ghraib Judge Implores U.S. Over Case
World,Dream Team Breezes Past Angola 89-53
World,Wal-Mart Sales Slump Sends Stocks Sliding
Sci/Tech,"Gateway's PCs, Notebooks Available at MicroCenter"
Business,"Santander to Cut 3,000 Jobs at Abbey After Takeover (Update1)"
Business,UK #39;s ARM to buy Artisan of US
Business,Toys R Us Swings to Profit
Sci/Tech,Drought In West Grounds Boaters
Sci/Tech,Lan switch sales looking good for 2004
Sports,Radcliffe baffled by failure
Sports,Golf: Cink in command in winning NEC Invitational
Sci/Tech,Transmeta suffers hype and hardware reality
Sci/Tech,HP to manage IT for Finnish energy giant
Sci/Tech,"Cisco, Microsoft merge IP telephony with CRM"
Business,Playboy plan for a private lifestyle club in Shanghai
Business,"Toys  quot;R quot; Us Posts 2Q Profit, Sales Fall"
Business,The Economy Is Killing Overtime
Business,Southwest Airlines to Cut 88 Flights
Business,FedEx Ups Profit Estimates
Sci/Tech,Macromedia wires up Flex Builder
Sci/Tech,Germans shun violent video games
Sci/Tech,Math concepts may be limited by language
Sports,Will Pruett come down on Herd now?
World,Fighting continues in Najaf amid shrine standoff
World,Volkswagen to Seek Wage Freeze in Contract Talks (Update4)
World, #39;Jackal #39; Accomplice Acquitted of Bombings
Sci/Tech,"Gateway's PCs, Notebooks Available at MicroCenter (Reuters)"
Sports,Basketball: U.S. Cruises Past Angola 89-53
Business,Blue Chips Flat After Wal-Mart News
Business,US Won #39;t Wait Long In Airbus-Boeing Row
Sci/Tech,U.S. Weighs Creation of Geologic Trail (AP)
World,Israel Plans 530 Settler Homes with U.S. Acquiescence
Business,Wal-Mart Cuts Sales View; Stock Dips
Sci/Tech,Intel lops Pentium 4 prices
Sci/Tech,Transmeta Plans for the LongRun
Sci/Tech,"Gateway #39;s PCs, Notebooks Available at MicroCenter"
Sci/Tech,AT amp;T CallVantage Service To Be Available in More Than 600 Best Buy &lt;b&gt;...&lt;/b&gt;
Sci/Tech,EDS picks Siebel as its preferred CRM vendor
Sci/Tech,TCEQ recommends changes to enforcement policies
Sports,Cink finally gets the monkey off his back
Sports,Defensive gem for Jays
World,"US planes bomb Najaf, hopes of peace fade"
World,Iraqis release kidnapped US journalist
World,George Bush is an  quot;imbecile quot; says North Korea
World,Kremlin candidate for Chechen presidency set to win
World,Foreign leaders commemorate centenary of Deng Xiaoping #39;s birth
Sci/Tech,An Open Music Platform
Sports,Birdie Helps Woods Retain Top Ranking (AP)
World,"'All Aboard' France's Artouste Express, France's highest-altitude train (AFP)"
Sci/Tech,Windows Upgrade Causing Campus Headaches (washingtonpost.com)
Business,Finding Friends   Foes (Forbes.com)
World,British energy expert alerts Ont. to failures in hydro restructuring (Canadian Press)
World,Race row as Mbeki blood rejected
Business,Toys R us Posts Operating Loss
Business,Dollar Rebounds as Oil Prices Ease
World,Nepal Confirms Its Nationals Kidnapped in Iraq
Business,Yukos cuts output to save money
Business,Rethinking Big Pharma
Business,Toys R us Posts Operating Loss
Business,Woolies in top-shelf profit
Business,Plot Advanced in Kmart Real Estate Story
Business,Schering Exercises License Option
Business,China demand boosts metal recycler
Sci/Tech,Macromedia Rolls New Flex Builder Tool
Sci/Tech,Stereo sun birds study space weather
Sci/Tech,OmniWeb browser takes aim at minority Mac market
Sports,Korzhanenko Stripped of Medal
Sports, #39;Dream team #39; beat improved Angola
Sports,An arena fit for a king
World,"Sudan #39;s rebels, government gather for talks"
World,"Bush a tyrant, declares Pyongyang"
World,Power failure hits Bahrain
World,Nepal confirms abductions in Iraq
World,Almost Perfect: U.S. Wins Softball Gold
World,Abu Ghraib Judge Implores U.S. Over Case
World,Stocks Fluctuate on Wal-Mart Sales News
World,The Lessons of Najaf
World,A New Manhunt in Pakistan
Business,"Spanish takeover will mean 3,000 Abbey job cuts"
Business,WWE Nearly Triples 1Q Profit
Business,"FedEx raises outlook to \$1 to \$1.10 per share for quarter, full &lt;b&gt;...&lt;/b&gt;"
Business,Russia #39;s Yukos cuts 2004 oil output forecast
Business,Oil price pain kicks in
Sci/Tech,Windows Upgrade Leads to Campus Headaches
Sci/Tech,Wireless Solution Illustrates Success of Unorthodox Strategies
Sci/Tech,Canon cashes in on digicam boom
Sci/Tech,BEA targeting ISVs with latest WebLogic package
Sci/Tech,Vonage VoIP service
Sci/Tech,Microsoft to join battle of the beats with music store
Sports,Gatlin wins sprint classic... by 0.01 seconds
Sports,Sturrock and Southampton part ways
Sports,Giant-Killers Claim Bundesliga Scalps
Sports,American leads early in decathlon
Business,Virgin axes route as fuel soars
Sports,COULTHARD CRITICISES SPA CHANGES
Business,Google slammed for corporate sleaze
World,Nepal: More Violence on Day Six of Rebel Blockade of Capital
Sci/Tech,RealNetworks Doesn #39;t Rock
World,Grenade deaths fuel violence
World,Kidnapped US Journalist Released
World,"Fears, prices soar as blockade tightens"
World,Karzai to arrive Pakistan
Sci/Tech,Linux may power South Korean schools
Sci/Tech,Microsoft Sends Digital Business Cards
Sci/Tech,"Don #39;t ditch that home phone for VOIP service just yet, experts &lt;b&gt;...&lt;/b&gt;"
Sports,Tears Flow as British Hail Plucky Loser Paula
World,US deserter starts life in Japan
World,Mexico Arrests Major Drug Trafficker (AP)
Business,Toys R Us Posts Operating Loss
Sports,Greece Hails New 'Immortal' Heroine
World,Spanish press fury over Eta bombs
Business,Blue Chips Flat After Wal-Mart Forecast
World,Rocky way ahead of Karzai to implement ambitious agenda
Business,Is Monster for Sale?
Sci/Tech,\$1bn to build unmanned fighter
Business,President admits country in fiscal crisis
Business,"Update 1: Yukos Cuts Output Forecast, Shares Fall"
Business,Toys  quot;R quot; Us Swings to 2Q Profit
Business,"UPDATE 4-UK #39;s ARM buys Artisan for \$913 mln, shares fall"
Sci/Tech,BEA packages Web application tools
Sci/Tech,EDS Joins Siebel Systems #39; New Global BPO Alliance Program
Sports,Everton board meeting postponed
Sports,Pin mania has swept the Games
Sports,BRUCE: SAVAGE HAS NO CASE TO ANSWER
Sports,Dumais advances in 3m springboard; Despatie top qualifier
Sports, #39;Russian roulette #39; Olympics death
World,US steps up pressure on Shiite militants in Najaf
World,Sudan Peace Talks Open in Nigeria
Sci/Tech,News: Meet the Peeping Tom worm
Sci/Tech,Otto Group Sells Stake in Travelocity Europe (Reuters)
World,"Santander Plans 3,000 Job Cuts at Abbey (AP)"
Sports,The U.S. Grabs the Gold in Softball
Business,Toys R Us Posts Operating Loss
Sci/Tech,Water Rises in Great Lakes After Near Record Low (Reuters)
Business,YUKOS Cuts 2004 Forecast Due to Tax Row
World,"Taiwan Issues Typhoon Warning, Markets to Close"
Business,Supreme Court should end legacy of Prohibition
Business,In the throes of a crisis
Sci/Tech,Macromedia Delivers Flex Builder
Sci/Tech,BEA #39;s WebLogic Bolsters Partners #39; Offerings
World,Judge demands faster action on Iraqi prison abuse investigations
World,Kenya #39;s  #39;first #39; graft conviction
Business,"Chavez Cannot Unite Divided Venezuela, Foes Say"
Business,Stronach mum on Tobin
Sci/Tech,Forrester report: US online retail sales to top \$300B by  #39;10
Sci/Tech,Microsoft #39;s multicultural missteps
