y,X
World,Arafat admits 'mistakes' to MPs
World,Stocks Are Seen Off a Touch at Open
World,Arafat Admits Palestinians Made Mistakes
Business,Google Slashes IPO Price Range
Business,Nortel shares down on news of criminal probe
Business,Florida may be insurance bellwether
Business,Taxing bodies must approve lawsuit
Sci/Tech,Spammers in bed with virus carriers
Sci/Tech,Microsoft unveils mainframe integration tool
Sci/Tech,Sewage waters a tenth of world #39;s irrigated crops
Sci/Tech,Ford scraps Oracle-based purchasing system
Sports,Sprinters Withdraw from Olympics Amid Swirling Controversies
Sports,Tarnished silver for US women
Sports,Preview: England-Ukraine
Sports,USA gets silver in kayak singles
World,Bomb defused after Blair #39;s Italy visit
World,Downer upbeat after North Korea meetings
World,Nepal #39;s Maoist Rebels Blockade Paralyzes Kathmandu
World,Pakistan Offers Bounties on Six Wanted Terror Suspects
Sci/Tech,Home users get key Windows update
Sci/Tech,BioVeris Still May Lose Its Investment
World,3 Georgian Soldiers Slain in South Ossetia (AP)
World,Slavery's Harsh History Is Portrayed in Promised Land
Business,Brookstone Posts a Narrower Loss (Reuters)
Business,"Stocks to Watch on Wednesday, August 18"
Sports,U.S. Men Qualify for Final in Shot Put (AP)
World,Garda quiz two over African death
World,Complaints follow Haiti acquittal
Business,Unanimous vote to raise British interest rates: official minutes (AFP)
Business,Talbots Profit Meets Lowered Forecast (Reuters)
Business,High oil costs hit more airlines
Sci/Tech,Million more in broadband's reach
Business,Google Lowers Price Range
Business,"Pentagon flipflops, will pay Halliburton fully"
Business,Report: Bank of America to lay off Fleet workers
Business,Applied doubles revenue
Sci/Tech,Sony Develops New Chip for More Real and Refined High Definition Video
Sports,"Athletes Return to Olympia Home After 1,611 Years (Update3)"
Sports,Dampier headed to Mavericks?
Sports,SI.com
World,"Rwanda, Burundi threaten with Congo invasion"
World,Soldier Killed in Action Named
Business,"Seiyu posts first half net loss on slower sales, higher costs (AFP)"
Business,Dollar Fights to Keep Off August Lows
Sci/Tech,Japanese bank taps RFID for document security
Sci/Tech,"Google drops target price, extends auction to Wednesday"
World,"Summer storms lash Europe, deaths in France (AFP)"
Business,Before-the-Bell: Taser Climbs
Sci/Tech,Google slashes target stock launch value (AFP)
World,Singapore Suspends Some Poultry Imports (AP)
World,Religion Experts Ask How Jesus Would Vote (AP)
Business,Oil tops \$47 a barrel
Business,Refinancings soar 21 as rates slump
Business,High oil costs hit more airlines
Business,Nestle Reports First Half Net Profit
Business,Georgia Power wins ruling on research study
Sci/Tech,Home users get key Windows update
Sci/Tech,This information has been provided by the State Statistics Committee
Sports,Greek sprinters #39; withdrawals lift cloud over Games
World,Germany #39;s Schroeder confirms adopting Russian toddler
Business,Before-the-Bell: Taser Climbs (Reuters)
Business,Dillard's Posts Narrower 2nd-Quarter Loss (Reuters)
Sci/Tech,"Gartner revises PC market forecast, warns of downside (MacCentral)"
World,Medical Experts Fear Charley's Aftermath
World,8 Terror Suspects Appear in British Court
World,Greek Sprinters Withdraw From Olympics
World,Google Cuts Its IPO Price Range
Business,Google Slashes Price of Shares in Initial Public Offering
Sci/Tech,How Old is the Milky Way?
Sci/Tech,"Google Lowers IPO Price, Limits Shares"
Sports,American Swimmers Fired Up by Relay Win
Sports,U.S. Rowers Advance
World,Google Confounds European Investors (Reuters)
World,Home users get Windows update
World,Assam strike over rebel attacks
Business,Google Slashes the Size of Its IPO
Business,Yukos sells gas stake
Business,Futures point lower
Business,Airlines under pressure from soaring fuel price
Business,Costco Tests Casket Market
Business,Global miner BHP Billiton posts record net profit as demand soars
Business,"Nestle Net Rises 2.1, Less Than Forecast, on Costs (Update6)"
Business,China Mobile increases earnings 7.8
Sci/Tech,Cassini-Huygens discovers two new Saturnian moons
Sports,Greek Sprinters Withdraw From Olympics
World,Can the peace in Najaf be achieved?
World,"Georgian, South Ossitian Forces Continue Fighting"
World,China battles for North Korea nuclear talks
World,Nepal rebels cut off routes to capital in first-ever blockade
World,Annan: Burmese Democracy Will Fail Without Participation By Opposition
World,"Philippine Rebels Free Troops, Talks in Doubt"
Business,Stocks Set to Open Lower as Oil Hits High
World,Zoo Separates Baby Rhino from Clumsy Mother (Reuters)
World,Hong Kong Politician's Detention Condemned (AP)
Business,Dillard's Loss Narrows But Off Estimates
Business,Eurozone inflation rate falls in July
Sports,US Sighs with Relief But Basketball Concerns Linger
Sports,Zijlaard-van Moorsel wins women #39;s road individual time trial
World,Najaf militants given hours to surrender or face lesson
World,Burundi Summit Expected to Focus on Massacre
Business,Monsanto Says Justice Dept Closes Inquiry (Reuters)
Business,Brown Shoe Earnings Drop 32 Percent (Reuters)
Business,Brown Shoe Earnings Drop 32 Percent
Sci/Tech,SAP users warned of false support calls
World,Five killed in Kashmir violence
World,U.S. Men Qualify for Final in Shot Put
World,Google Cuts Its IPO Price Range
Business,Oil Prices Surge to a New High Today
World,Iraqis Decline to Send 2nd Peace Mission to Najaf
Business,"Google lowers price range, number of shares, for its IPO"
Business,China Mobile Reports Jump in Profits
Sci/Tech,Intel delays HDTV market debut
Sci/Tech,Script kiddies join forces with spammers
Sci/Tech,Microsoft readies Host Integration Server 2004
Sci/Tech,Cryptography break threatens digital signatures
Sports,Endurance swimmers short-changed at Olympics: Hackett
Business,Oil at New Record
Sci/Tech,Radiation and Drug Combo Help With Prostate Cancer
Sci/Tech,Medical Experts Fear Hurricane Charley's Aftermath
Sci/Tech,Malaysia's Sea Turtles Are in Trouble (AP)
Sci/Tech,Future Flyers: Pushing Forward for Personal Aircraft (SPACE.com)
Sci/Tech,Twisted Physics: How Black Holes Spout Off (SPACE.com)
World,Kerry to Attack Bush Troop Withdrawal Plan (Reuters)
Business,Google Cuts IPO Price by a Quarter to \$85-\$95 a Share (Update7)
Business,Supply worries push oil to record
Business,8/17/04 - Us Concerned About Yukos
Business,Dillard #39;s Posts Narrower 2Q Loss
Business,Stocks Open Lower
Business,E*Trade Says Customer Trading Dipped in July
Business,Brown Shoe Earnings Drop 32 Percent
Business,Cendant Steals Home
Sci/Tech,Malaysia turtle nesting sites at risk -scientists
Sports,American Swimmers Fired Up by Relay Win
Sports,Dope scandal athletes withdraw
Sports,Renewed focus ends nightmare
Sports,Not quite good as gold
World,Burundi police fire tear gas at massacre protest
Business,BellSouth:  #36;3.3 Bln Rise in Benefit Costs (Reuters)
Business,Crude Oil Prices Surge Again
Business,UK challenge of India outsourcing
Business,"Google, Set for Offering, Cuts Share Price by About a Quarter"
Sci/Tech,Windows XP Security Update Delayed
Sci/Tech,New PC Is Created Just for Teenagers
Sci/Tech,Violence Tackled at Online Gaming Parlors
Sci/Tech,Web Site Shows New York Drug Prices
Sci/Tech,U.S. Broadband Growth Slows - Analyst
Sci/Tech,Google Slashes Its IPO Price Range
Sports,GB badminton duo make final
World,Bomb Found in Town Near Berlusconi Villa (AP)
World,"Just Keep It Peaceful, Protesters; New York Is Offering Discounts"
World,Huge boost to Darfur aid effort
Business,"Google, Set for Offering, Cuts Share Price by About a Quarter"
Business,BHP profit rises 78 on Chinese demand
Business,BellSouth: \$3.3 Bln Rise in Benefit Costs
Business,"Military flipflops, will pay Halliburton fully"
Business,"Dillard #39;s misses estimates, shares plunge"
Business,Barclays to Buy CIBC Credit Card Unit for \$293 Mln (Update1)
Business,Applied Materials
Business,Nestle #39;s 1st Half Net Profit Hits \$2.28B
Sci/Tech,Ringtones are music to record labels #39; ears
Sci/Tech,Malaysia #39;s Sea Turtles Are in Trouble
Sports,Kenteris and Thanou Withdraw; Thorpe Targets 3rd Gold (Update2)
Sports,"LeBron, USA Slide By Greece"
Sports,US women crush South Korea for third straight blowout win
Sports,Canadian tutu man gets five months for Olympic plunge
World,Howard stands by overboard account
Business,Weak Ice Cream Sales Melt Nestle's Profit (Reuters)
Business,Weak Ice Cream Sales Melt Nestle's Profit
Business,ING to Withdraw \$5 Bln from Janus Funds
Sci/Tech,Tech Goes for Gold in Athens
World,Hilton Offers Reward for Lost Chihuahua
World,Arafat Admits Palestinians Made Mistakes
Business,Air Canada Stock Plunges on Review
Business,Pentagon Backs Off Halliburton
Sci/Tech,Rival Targets Apple's iTunes Customers (AP)
Business,Air Canada Stock Plunges on Review (Reuters)
Sports,U.S. Shooter Wins Gold
World,"US says ""getting nowhere"" with crisis in Darfur (AFP)"
Sports,Utah's Smith Sets Sights on Heisman Award (AP)
Business,Economies Not Yet Dented by Oil Prices
Business,Stocks Up; Investors Bottom Fishing
World,England reach for the painkillers as World Cup qualifiers loom (AFP)
World,Delegate: Al-Sadr Agrees to Withdraw (AP)
World,Shanghai's Economy Grows 14.7 Percent (AP)
Business,Web giant Google cuts IPO prices
Business,Record \$4.7bn profit for BHP
Business,Insurers #39; Storm Swirls Around Chubb
Business,Dillard #39;s Posts Narrower Loss in 2Q
Business,Cox Hires Advisers on Parent Bid
Sci/Tech,Is Upgrading to Windows XP SP2 Worthwhile?
Sci/Tech,Google cold shoulder confounds European investors
Sci/Tech,A Nokia Smartphone With An Edge
Sci/Tech,Microsoft wants Web designers to use content tagging
Sports,US comes in second in women #39;s cycling
Sports,Alonso Next in at Anfield
Sports,Let the Games (and parties!) begin
Sports,Wilkinson Ready To Take Next Step Along Road Back
Sports,Berry misses cut at US Amateur
World,Bomb Found in Town Near Berlusconi Villa
World,Downer positive over North Korea talks
World,Hong Kong pro-Beijing politicians accuse opponents of misleading public over sex scandal
World,Iran retaliation threat to Israeli N-plant
World,N. Ireland deal hinges on IRA disarmament (AFP)
Sci/Tech,"Cisco Gets New Partner, Clients, Product in the Core"
Sports,Sportsview: Bills Get Playoff Hunger (AP)
Sci/Tech,Creating Compelling Search Engine Ads and Landing Pages
World,Iraq Delegates Say Sadr Agrees to End Najaf Crisis
World,Europe Urged to Continue China Arms Sales Ban
World,"Militants, Israeli Troops Battle in Gaza"
World,THE UNITED NATIONS The Campaign against Kofi
World,Hamas Militants Kill Israeli Soldier
Business,US oil stockpiles drop
Business,Barclays Move Towards US Credit Card Market
Business,Ford dumps \$200m Oracle system
Sci/Tech,Japan firm unveils world #39;s lightest flying micro-robot
Sci/Tech,China Unicom cuts ties with 45 ISPs to curb web porn
World,Fighting Resumes In Al-Najaf After Peace Mission Fails
World,What #39;s behind Israeli construction permits?
World,Chirac and Schroeder to meet with Putin
World,UN concerned by lack of Darfur progress on ground
World,"Get them caught, get 6 crores"
Business,Economies Not Yet Dented by Oil Prices (Reuters)
Business,SEC Bars Some Mutual Fund Fees (Reuters)
Business,Google Slashes IPO's Size
Business,SEC Bars Some Mutual Fund Fees
Business,Stocks Open Lower in Moderate Trading
Business,BellSouth Sees Higher Benefits Expense
Business,McDonald #39;s tests MasterCard PayPass
Business,Chinese boom pays off for BHP
Sci/Tech,Real v Apple music war: iPod freedom petition backfires
Sci/Tech,Security Watch Letter:New MyDoom Piggybacks More Dangerous Worm
Sci/Tech,IBM Offers New POWER5 eServer i5 550
Sci/Tech,"Marriage between security, business needs"
Sports,Life of Reilly: Athens style
Sports,Springboks targets scrum
Sports,Dyer up for sale on ebay
Sports,Chicago White Sox Team Report - August 18
World,Iraqi Delegates Say Sadr Agrees to End Najaf Crisis
World,Howard defiant as attacks mount
World,6 dead in typhoon deluge
World,Health hurdle for Latham #39;s campaign
Business,AT amp;T team wins \$1bn network deal
Business,Profit Takers Ambush Treasuries
Business,Steel boom boosts Iscor's profits
Sci/Tech,Boy Escapes Cougar Near Canada's Jasper Park (Reuters)
Business,Tiffany  amp; Co. selling stake in Aber Diamond
Business,Intel Says It's Recovered from Missteps (Reuters)
Sports,Illini Hope To Reinvigorate Football Program With Zook
Sports,Zeeland #39;s Kaat to be considered for Hall
Sports,Athletes cheat way to fame and fortune
Sci/Tech,Cisco-Fujitsu Deal Highlights Japan #39;s Internet Dominance
Business,Citigroup faces regulatory probe
Sci/Tech,eCOST.com Cuts IPO Price to  #36;7 a Share from  #36;9- #36;11 (Reuters)
Business,OPEC Hawks Want to Keep Prices High
Business,Google Slashes IPO #39;s Size
Business,Update 3: Russia: China to Cover Yukos #39; Rail Fees
World,Iraqi official: cleric agrees to withdraw forces from Najaf shrine
Business,SEC Seen Making Google IPO Effective
Business,Stocks Gain as Oil Ease from New High
Business,Deere's Color Is Green
Business,Linux wins heart of global SAP user
Sci/Tech,Compuware Accuses IBM of Ambush Tactics (AP)
World,PA minister: Barghouti will drop candidancy
Business,SEC Seen Making Google IPO Effective
World,"Cheney, Rumsfeld Say Terror Remains Threat"
Business,SEC Seen Making Google IPO Effective
Business,Download a Song for 49 Cents
Business,RCMP initiates Nortel investigation
Business,"Profit climbs at Talbots womenswear chain, helped by tax gain"
Business,Citigroup Bond Trading Investigated by UK Regulator (Update1)
Business,"Fund managers raise cash-asset level, says survey"
Business,Court approves St. Paul \$502.5 mln asbestos accord
Sci/Tech,"Epson builds lightest, smallest micro-flying robot"
Sci/Tech,Norton #39;s 2005 security line-up
Sci/Tech,Samsung streams on Sprint with MM-A700
Sports,Greek heroes quit Games
Sports,Germany Paddles to Bronze
Sports,Dutch cyclist #39;s fairytale comeback
Sports,Hamilton takes gold in time trial
World,Sadr agrees to accept Iraq peace mission demands
World,UK Terrorist Suspects Have Case Sent to Old Bailey (Update2)
Sports,US ; Japanese-born teen youngest US chess champ since Bobby &lt;b&gt;...&lt;/b&gt;
Sports,Pacers #39; Foster activated from injured list
Sports,Report: Tougher testing on the way for MLB
Sci/Tech,Preview of SQL Server 2005 Released
Sci/Tech,BusinessWeek Special Report Examines Apple #39;s iPod Lead
Sci/Tech,Microsoft nears release of 64-bit Windows
Sci/Tech,IBM Nabs \$750M Deal with Lloyds TSB
Sci/Tech,"Students Win \$100,000 in National Team Science Competition"
Sci/Tech,Experts Push for More Computer Security Efforts
Sci/Tech,"Group Enlists Honey Pots to Track IM, P2P Threats"
Sci/Tech,"Cisco, Juniper Making Noise in High-End Routing Space"
Business,SEC Seen to OK Google IPO After 4 P.M.
Business,BellSouth: Retiree Costs to Cut Q4 Earns
Sci/Tech,GAO: Homeland Security #39;s Enterprise Architecture Lacks Key Elements
Sci/Tech,Compuware Asks Court To Sanction IBM In Software Theft Case
Sports,US Men Take Gold and Bronze in Cycling Time Trial
World,Iraqi Cleric Agrees Deal to End Siege at Shrine
World,Burundi police fire tear gas at massacre protest
Business,"Google Slashes IPO, SEC OK Expected Today"
Sci/Tech,"HP decries Itanium, SAP issues and bad English"
Business,French watchdog fines Messier 1m
Business,Toyota tunes in satellite radio
Business,Sprint begins \$3 billion march to 3G
Business,Europe troubled by euro rise
Business,Oil Falls to 3-Month Low as Heating-Oil Supplies Probably Rose
Business,AOL Cuts 750 Jobs
Business,U.S. to Import 4 Million Flu Shot Doses
Business,Intel Says It's Recovered from Missteps
Sports,Tyson to Begin Training
World,Putin questions Iraqi poll plan
Business,Mortgage Applications Rise as Rates Ease
Business,Staples Goes to China?
Business,Crazy 'Bout a Sharp Dressed K
World,"Report: Palestinians, Israel Back Peace Plan"
World,Storm-ravaged peasants flee as Philippines runs out of money for relief (AFP)
World,Sudanese Hopeful of New Year Peace Deal
World,"After all, have we become Russias strategic partner?"
Business,Charley #39;s insured losses seen hitting \$7.4 billion
Business,US mortgage applications rise as rates ease
Business,Aurora Woman Sues Costco Over Discrimination Claims
Sci/Tech,Researcher Finds Flaws in XP SP2
Sci/Tech,RealNetworks Halves Music Prices But Move to Confront Apple Will Increase Company #39;s Loss
Sci/Tech,Compuware accuses IBM of ambush tactics in piracy suit
Sci/Tech,Microsoft Funded Study Deciding Factor in 10yr Deal
Sports,Bilonog Edges Nelson With Last Put as Shot Returns to Olympia
Sports,Figo takes break from international football
World,NLD MP urges people to sign petition
World,WFP Tackles  #39;Critical Six Weeks #39; in Darfur with Up-Scaling of Air Operations
Sports,Italy Lights the Path for the Olympic Torch
World,Lamy Strong Candidate for WTO Job-USTR (Reuters)
Business,Janus Finalizes Regulatory Settlement (AP)
Business,Italy's Parmalat sues ex-auditors
Sci/Tech,Study: Hubble Robotic Repair Mission Too Costly
Sci/Tech,Dell Cuts Prices on Enterprise Hardware
Sci/Tech,Boston Globe:  #39;Forget Microsoft and buy an Apple iPod - it works #39;
Sci/Tech,Thunderbird Mail goes 1.0
Sci/Tech,Nvidia to work on PlayStation 3 chip
Business,SEC Bars Mutual Fund Payoffs to Brokers
Business,Air Canada Stock Plummets on Review
Business,Parmalat Sues Ex-Auditors in Chicago
Sci/Tech,Apple zealots slam Real #39;s iPod campaign
Sci/Tech,Macromedia offers Flash video tool
Sci/Tech,Apple G5 chips  #39;in short supply #39;
Sports,Cycling: Hamilton wins time trial
Sports,Jail for Olympic pool jump
World,Leaders Threatened by Terrorist Groups Large and Small
World,Food crisis worsens in North Korea
World,German investor confidence surges
World,EU Weighs Tougher Conditions for Talks With Turkey (Update1)
Business,Airlines to Cut Flights at Chicago O'Hare
Business,FAA: Flight-Reduction Deal Set for O #39;Hare
Business,Italy #39;s Parmalat sues ex-auditors
Business,Update 2: Swisscom Confirms May Merge With Firm
Business,Cox directors look at proposed buyout
Sci/Tech,Cassini Probe Discovers Tiny Saturnian Moons
Sci/Tech,MS Host Integration Server 2004 Is Weeks Away
Sports,Figo takes break from international game
Sports,Van Basten entrusts Dutch captaincy to Davids
Sports,Russia #39;s Korzhanenko wins women #39;s shot put; American favorites eliminated
Sports,US rowers advances in photo finish
World,Sadr calls for Najaf ceasefire
World,"Dhiren to father, Abu Musa to al Qaeda"
World,Terrified neighbours see dog kill owner
Sports,Garrison gets new contract; King retires
Sports,VARSITY MATCH
Sci/Tech,Nintendo Game Machine Gets Good US Start
Sci/Tech,Fledgling Thunderbird takes on Outlook
Sci/Tech,"Cybersecurity post needs a promotion, firms say"
Business,"Toyota strikes satellite radio deals with rivals XM, Sirius"
Business,AT amp;T Wins \$1B Treasury Contract
Business,"UPDATE 1-SEC, NASD probing Jefferies trader #39;s gifts -WSJ"
Business,Report: J amp;J in Talks to Acquire Guidant
Business,"Google Slashes IPO, SEC OK Expected Today"
Business,Stocks Up; Traders Eye Crude Oil Prices
Sports,Houston serious about keeping its superstar center fielder
Business,"Charley May Cost Insurers \$7.4 Billion, Industry Says (Update1)"
Business,"Parmalat sues ex-auditors Deloitte, Grant Thornton"
Business,Barclays Buys CIBC US Credit Card Unit for \$293 Mln (Update5)
Business,"Tap, Eat, N Go"
Sci/Tech,Broadband used by 51 percent of online population
Sports,Canadian who leaped into Olympic pays the price for 15 minutes of fame
Sports,Els targets improved putting after Whistling Straits woes
World,"8 terror suspects, including alleged al-Qaida figure, charged in Britain"
World,UN rights envoys urge probe into Burundi massacre
World,One Hamas leader survived assassination; five Palestinians killed in an Israeli bombardment in Gaza
World,Swiss to hand back more Abacha funds
World,WFP Relying On Airdrops To Bring Food In West Darfur
Sports,Late try gives Oxford win
Sci/Tech,Dell trims PC prices for business clients
Sci/Tech,"NASA #39;s Return to Flight on Track, Shuttle Officials Say"
Business,What's Google Minus \$10 Billion?
Sci/Tech,Wind River's Smooth Sailing (The Motley Fool)
Sci/Tech,Teleportation goes long distance
Sci/Tech,Europe Is Warned of Changing Climate (AP)
Business,Clinton: Ex-President Inaugurates China-Backed Internet Search &lt;b&gt;...&lt;/b&gt;
Business,High court hears dispute over Michigan interstate wine sales
Business,Stocks Move Higher on Mixed Economic Data
Business,IBM: Do We Have a Deal?
Business,Three IPOs Trim Price Ranges Wednesday
Business,"Oil at \$47, Economic Impact Seen as Muted"
Business,"McDonald #39;s testing deli sandwiches in Louisville, other markets"
Sci/Tech,Netscape #39;s Official New Browser is Out
Sports,"Kenteris, Thanou Quit Games; Thorpe Record Bid Fails (Update6)"
Sports,"Roddick, Williams eliminated from Olympic tennis"
Sports,Giambi calls strain  #39;nothing serious #39;
Sports,Olympics: Venus out of Olympics
World,Sadr calls for Najaf ceasefire
Business,Something's Brewing at Diedrich Coffee
World,"Report: Palestinians, Israel Back Peace Plan"
World,State Dept. Warns of Violence in Laos (AP)
Sci/Tech,VIDEO GAME REVIEW: Driv3r Plot Is Tedious (AP)
Business,Credit Suisse to Focus on Investment Bank
Business,U.S. Economic Outlook Dims a Bit
World,Workers fight bad weather to give aid to storm-ravaged Philippines; 740 dead (Canadian Press)
Business,Update 3: Bank of America Cuts Some Fleet Workers
Business,SEC Bars Mutual Fund Payoffs to Brokers
Business,Barclays buys Juniper Financial for \$293M
Business,UAL agrees to independent agents to oversee pension funds
Sci/Tech,Compuware asks court to punish IBM
Sci/Tech,Investors Unfazed by Last-Minute Google Moves
Sci/Tech,Charley a Harbinger of Busy Hurricane Season?
Sci/Tech,Report: Apple G5 chips scarce
Sports,American Cyclist Hamilton Wins Time Trial
Sports,Kitajima wins breast stroke double
World,State Dept. Cautious of Najaf Reports
World,Pakistan publishes photos of six suspects wanted in terror
Sports,Steroid Talks Progress
Sports,Italy Lights the Path for the Olympic Torch
World,Five die in renewed Gaza fighting
Sci/Tech,Dual-Format Disc That Plays Both HD DVD and DVD
Sci/Tech,Energy from waves  teenager wins science award
Sci/Tech,Program Lets People Design 3-D Objects (AP)
Business,1.2 million flu shots will stay in Canada after all
Sci/Tech,Windows XP SP2 Help
Sci/Tech,Slim Majority of Web Users Connect With Broadband
Sports,Bilonog Wins Olympia Shot Put Gold
Sports,Kitajima wins breaststroke double
World,Nigerian senate to rule on Darfur troop deployment
Sci/Tech,Google IPO Is Small Hurdle Vs Growing Competition (Reuters)
Sports,PAC-10 MEN #39;S Basketball: Timing of Bibby firing irks Olson
Sports,Pacers #39; Foster Activated From Injured List
Sci/Tech,Physicists Teleport Photons Across Danube
Sci/Tech,British Cave Yields Elaborate Ice-Age Art
Sci/Tech,Venus: Inhabited World?
Sci/Tech,Particle Physics in a New Universe
Sci/Tech,Compuware asks court to punish IBM
Sci/Tech,A brighter Outlook?
Sci/Tech,Briefly: Macromedia offers Flash video tool
Sci/Tech,Macromedia offers Flash video tool
Sci/Tech,Microsoft tightens Windows-mainframes link
Sci/Tech,Red Hat names new services executive
Sci/Tech,Report: Apple G5 chips scarce
Sci/Tech,MCI to overhaul network for international calls
Sci/Tech,Study: Broadband leaps past dial-up
Sci/Tech,UTStarcom wins Indian IP gear contract
Sci/Tech,Juniper engineers depart for start-up
Sci/Tech,Real gets flamed over iPod campaign
Sci/Tech,Hynix to build chip plant in China
Sci/Tech,Researchers find holes in XP SP2
Sci/Tech,Google faces another trademark suit in Germany
Sci/Tech,Where to Dump Your Dead Technology
Sci/Tech,BlackBerries Take Aim at Terrorism
Sci/Tech,"Google, WebSideStory, Claria Show Negative IPO Trend"
Sports,U.S. Coach Larry Brown Won't Make Changes (AP)
Sports,Manning to Get First Start Vs. Panthers (AP)
Sports,Toronto Raptors Sign Center Loren Woods (AP)
Sports,Indians Call Up Righty Fernando Cabrera (AP)
Sports,Hamm of U.S. Wins Men's Gymnastics All-Around Gold
Sports,Americans and Dutch Strike Gold in Cycling
Sports,U.S. Women Break Oldest Record for Relay Gold
Sports,"Henry, Phelps on Record Track to Gold"
Sports,Hamm Wins Gold for U.S.
Sports,U-Va.'s Brooks Out
Sports,Nelson: Shot Put Silver
World,Olympian women escape the age barrier (AFP)
World,Russia investors skeptical of Yukos mad scramble for cash (AFP)
World,Israeli Helicopter Fires at Gaza Building (AP)
World,U.N. Food Agency Steps Up Sudan Aid (AP)
World,Group Asks to Protest in Central Park (AP)
World,New York Vs. the Protesters (washingtonpost.com)
World,Retiring GOP Rep.: Iraq War Unjustified (AP)
World,Lawyers Defend Wen Ho Lee Reporters (AP)
World,"Iraq Cleric Agrees to End Uprising, Demands Truce"
World,Israel's Sharon Confronts Party Rebels Before Vote
World,U.N. Tries to Calm Frontier After Burundi Massacre
World,Cleric Who Died in Pakistan Custody 'Tortured'
World,Cleric dies in Pakistan custody
World,Teleportation goes long distance
World,8 Terror Suspects Appear in British Court
World,Demand Soars for Laughing Cow Cheese
World,"Venus, Roddick Upset in Olympic Tennis"
World,Kerry Decries Bush Plan to Recall Troops
World,'Potential Development' in Peterson Case
World,Stocks Are Up Despite Rising Oil Prices
World,Kerry Decries Bush Plan to Recall Troops
World,Stocks Climb Despite Rise in Oil Prices
World,'Potential Development' in Peterson Case
World,Sadr Signals He Will Accept Peace Plan
World,China Detains Prominent Buddhist Leader
Business,"Stocks End Higher, Dow Back Above 10,000"
Sci/Tech,Unpatched PC  quot;Survival Time quot; Just 16 Minutes
Sci/Tech,Add-On Toolkit For Outlook Cuts Clutter
Sci/Tech,IBM  #39;ambush #39; accusation
