y,X
Business,Taiwan's Economy Expands at Fast Pace (AP)
Business,Advocate Or Promoter? (Forbes.com)
Business,Crushing the Little Guys (Forbes.com)
Sci/Tech,Cheapware (Forbes.com)
Sports,Greek Athlete Tests Positive for Drugs
Business,General Growth to Buy Rouse for \$7.2 Billion
Sports,Baseball must clean up its act
Business,General Growth Set to Buy Rouse for \$7.2B
Business,Best Buy sued for  #39;ripping off #39; consumers
Business,Insurance giant Aetna to buy Columbia company for \$250 million
Sci/Tech,BlackBerry in Sync with Apple
Sports,NASCAR driver killed
Sports,Jamaica #39;s Fuller joins Portsmouth
Sports,Chicago White Sox Team Report - August 20
World,Georgian troops pull out from conflict zone after intense fighting
World,US Hostage in Good Health - Jazeera Tape
Sci/Tech,Marrying the Ideal to the Real (Forbes.com)
Business,Stocks Higher as Oil Eases
Sports,Tigers' Craig Monroe Facing Theft Charge (AP)
World,Stocks Higher As Oil Nears \$50 a Barrel
World,Militants Remove Arms From Najaf Shrine
Business,NFL Game Tackles Competition
Sci/Tech,Google shines on second day
Business,Dollar Up Vs. Most Except Yen
Sci/Tech,N.C. Co. Develops Germ-Fighting Clothes (AP)
Sci/Tech,Brazil Tribe Has Great Excuse for Poor Math Skills (Reuters)
Sci/Tech,Strong growth for Linux servers
Sci/Tech,Apple Recalls PowerBook Batteries
Sci/Tech,Researchers Spot XP SP2 Security Weakness
Sci/Tech,Reports criticize DHS for lack of progress on IT
Sci/Tech,Yahoo fixes two flaws in mail system
Sports,Massu beats Dent to reach gold medal match
Sports,Swansong for Gebrselassie
Sports,"Meares, Hoy win cycling gold in record times"
World,Sadr #39;s aide denies entering of Iraqi police into Najaf shrine
World,"Syrian, Algerian arrested over Madrid train bombings"
Business,Second Chance on Lone Star
World,EU's incoming antitrust chief says honorary degree won't affect view of Gates (Canadian Press)
World,Iraqi footballers' fury at Bush
World,Venezuela audit 'confirms' result
Sci/Tech,Napster Founder Introduces New File Sharing Service
Sci/Tech,"Thunderbird 1.0 takes on Entourage, Eudora"
Sci/Tech,Analysts spot slump in LAN switch market
Business,Rouse Jumps on General Growth Buyout
Business,Stocks in Motion: Wet Seal
World,Berlusconi hair mystery revealed by Italian surgeon (AFP)
Sci/Tech,Xbox to Stop Making Some Sports Games (AP)
Sci/Tech,"Birders Flock to See Rare, Lonesome Falcon (Reuters)"
Business,Oil Producers Emerging to Sell at Record Prices
Business,Dollar Up Vs. Most Except Yen
Sci/Tech,Soft Demand for TFTs Affects Prices
Sci/Tech,New Download.Ject Attack Hits IM Networks
Sports,"Carly Patterson, Paul Hamm help define these Games"
Sports,Hoy wins gold by a whisker
World,Bombs explode in Nepal capital
World,Prints lead to two Madrid arrests
Business,"UAL, Creditors Agree to 30-Day Extension (Reuters)"
Sports,NFL Suspends Saints' Hodge for 4 Games (AP)
Sports,Swimming: Shibata Wins Women's 800m Freestyle
Sports,Webb Ousted in Prelim
World,U.S. Soccer Team Fights Past Japan 2-1
World,Stocks Move Higher As Oil Prices Decline
Sci/Tech,"Nature and Nurture, the Recipe for Olympic Gold"
Sci/Tech,"Maine Program Asks Sea-Kayakers to ""Leave No Trace"""
Business,Airfares to rise as cost of fuel reaches record
Business,The Rouse Co. sold for \$12.6 billion
Business,"UAL, creditors agree to extend exclusivity 30 days"
Business,Anadarko to sell Gulf of Mexico shelf properties for \$1.3B
Business,Highland buys Tremont Boston in four-hotel deal worth \$227M
Business,US #39;s Snow-dollar to remain top reserve currency
Sci/Tech,NASA Recruits Stunt Pilots To Catch Sun Capsule
Sci/Tech,Canon unveils new digital camera quartet
Sports,Phelps wins duel with Crocker
Sports,"Security for Olympics Successful, Greek Defense Minister Says"
Sports,"Not Roddick, but Fish reaches finals"
Sports,USA women pass first big test: Spain
Sports,Father of crew chief killed in crash
World,Confusion Surrounds Seizure of Iraqi Mosque
World,Report: Japanese court dismisses request to halt deportation of chess legend Bobby Fischer
World,Australian opposition leader to leave hospital
Business,Sensei's World (Forbes.com)
World,U.S. Vets Make Case for Kerry in Vietnam (AP)
Sci/Tech,Group Finds Ancient Ships Off Italy Coast (AP)
Business,EU commissioner admits Gates link
World,Phelps Wins 100-Meter Butterfly
Sci/Tech,Maker of disposable RFID tags gets millions
Sci/Tech,Best Software strategizes for midmarket dominance
World,Mood Mixed Among Darfur Rebels Ahead of Talks (Reuters)
World,"Two Blasts Rock Market in Ukraine Capital, 13 Hurt (Reuters)"
Sports,Yanks' Giambi Gets Groin Strain Treatment (AP)
World,Guilty plea from N.B. man who allegedly planned shooting spree rejected (Canadian Press)
Sports,Pirates' Wells to Miss 2nd Straight Start (AP)
Sports,"Phelps Captures Fifth Gold, Seventh Medal"
World,Sadr Militia Still Controls Iraq Shrine -Witnesses
Sci/Tech,US E-Commerce Sales Rise in Second Quarter (Reuters)
Sci/Tech,Italian deputies drowned out in mobile phone clampdown: report (AFP)
Business,Death Watch (Forbes.com)
Business,"UAL, creditors agree to 30-day extension"
Business,Mall Retailers Trim Estimates
Business,Highland Buys Four Hotels From Wyndham
Sci/Tech,"Apple Recalls 28,000 G4 Laptop Batteries"
Sci/Tech,Google #39;s ups and downs
Sci/Tech,AMD To Add  #39;Strained Silicon #39; To Processors
Sports,Phelps adds yet another gold
Sports,"America #39;s great hope in 1,500 can #39;t make it out of first round"
Sports,US women #39;s soccer through to semifinals
World,Chad: Hepatitis E Breaks Out As More Refugees Threaten to Cross Border
Sci/Tech,Briefly: Gmail delivered to desktops
Business,"Oil Falls from  #36;49, Iraq Violence Peaks (Reuters)"
Sports,Bills' McGahee Said to Ask for Trade (AP)
Sports,Golfer Thatcher Leads at Reno-Tahoe Open (AP)
World,Thirty-three injured when Air Portugal plane dives to avoid collision (AFP)
World,Three Indicted in Raising Funds for Hamas (AP)
Business,Giving Voice to A Billion Things (Forbes.com)
World,Japanese Court Dismisses Fischer Request (AP)
Sports,C-USA Officials Vote on League Title Game (AP)
World,Militants Remove Arms From Najaf Shrine
World,Stocks Edge Higher As Oil Prices Fall
Business,Nortel: Nowhere To Go But Up
Business,Unions  #39;close to BA deal #39;
Business,Rouse Co. to be sold for \$7.2 billion
Business,Chinadotcom Gets Sanctions From China Mobile Communication
Business,Bank of America quiet regarding local layoffs
Sci/Tech,NASA turns to stunt pilots to snag solar stardust
Sci/Tech,"Ancient Mask,  #39;Olympic #39; Ring Found in Thracian Tomb"
Sci/Tech,Broadband Use Passes Dial-Up
Sports,Greek weightlifter tests positive
Sports,Hall defends 50m crown
Sports,"Harmison takes eight, England near clean sweep"
Sports,Cyclists find fast track as competition begins
Sports,"America #39;s great hope in 1,500 has early exit, Devers squeaks into 100 semis"
World,Sadr Militia Still Controls Iraq Shrine -Witnesses
World,"Putin Calls on Tbilisi, Tskhinvali for a Compromise"
World,Prime Minister #39;s Expected Resignation Overshadows Hungary #39;s National Day
World,2 held over Madrid train bombings
Business,Super search Accoona.com launched in US and China
Sports,"Raiders, Cowboys Look to Improve Games (AP)"
World,Germany drops junta prosecutions
Business,Is United Taking Aim at Retirees?
Business,Deduct IRA Losses? In Some Cases
Business,Stocks stall at open
Sci/Tech,Contracting Riches For Nation's Capital
Sci/Tech,Xbox to Stop Making Some Sports Games
Sci/Tech,Microsoft Shuts Sports Video Games Unit (Reuters)
World,List of Foreigners Taken Hostage in Iraq (AP)
Business,"UAL, Creditors Agree to Extend Exclusivity 30 Days"
Sci/Tech,"NASA Researchers, Stunt Pilots Prepare for Genesis Probe's Return (SPACE.com)"
Sci/Tech,Scan the Summer Sky for the Archer (SPACE.com)
World,Kerry Stirs Gasoline Debate Amid Record Oil Prices (Reuters)
Business,U.S. Stocks Gain as Oil Eases
World,Sadr Militia Still Controls Iraq Shrine - Witness
Business,Feds Subpoena Fannie Mae in Probe-Source
World,US arrests two Hamas 'racketeers'
Sci/Tech,FDA to Inspect Boston Scientific Stent Plant -WSJ (Reuters)
Sci/Tech,Music Piracy Lawsuits Wend Through Court (AP)
Sports,Saints' Hodge Is Suspended for Four Games (Reuters)
Business,Money Out of a Pipeline (Forbes.com)
Business,Oil Falls from Highs After Missing \$50
Sports,ACC Football Begins New Era With Miami (AP)
Business,"UAL, Creditors Agree to 30 Day Extension"
Business,Stocks Rise as Oil Retreats from High
Business,Treasuries Edge Down as Oil Retreat
Business,Brazil finds true value of art
Business,Jobs cut in Credit Suisse reshuffle
World,Phelps' Fourth Individual Gold Ties Spitz
World,Militants Still in Control of Najaf Shrine
World,United Argues It May Terminate Pensions
Sci/Tech,Briefly: Linux release features Windows support
Sci/Tech,PostgreSQL 8.0 will run on Windows
Sci/Tech,Linux release features Windows support
Sci/Tech,AMD using strained silicon on 90-nanometer chips
World,Groups Meet to Discuss Climate Change
Sci/Tech,Which Candidates Do Tech Companies Support?
Sci/Tech,Microsoft Sends XP SP2 Home
Business,"UAL, Creditors Agree to 30 Day Extension (Reuters)"
Business,Analysts See Grim Future for Wet Seal (Reuters)
Business,Fact and Comment (Forbes.com)
World,White House Deals With Detainee Legalities (AP)
World,Sadr Militia Still Controls Iraq Shrine -- Witness
Sci/Tech,Constantine and the rise of Christianity
Business,Electronic Arts Breaking Out
Sci/Tech,Microsoft benches sports games
Sci/Tech,Kazaa Owner Cheers Court's File-Swapping Decision
Sci/Tech,Yahoo Mail Fixes Security Flaws
Sci/Tech,News: Slow-moving lawsuits over music downloads producing court twists
World,Bloody Battle Dulls Cleric's Heroic Image (AP)
Business,Why Tech Stocks Stink (Forbes.com)
World,Hanes Opens Unmentionables Market in China (AP)
World,GOP Convention Light on Stars (AP)
Business,Stocks End Higher as Oil Eases
Sports,"Swimming: Fifth Gold, Seventh Medal for Phelps"
World,"Bush Spending Spree Continues, More Cash to Burn (Reuters)"
Sports,Swimming: Shibata Joins Japanese Gold Rush
World,Congo Former Foes Head to S.Africa for Talks
World,"Blast at Police Post in Nassiriya, Three Dead"
World,UN warns of Sudan refugee exodus
Sports,Miami Struggles on Offense
World,Phelps to Forgo Final Race of Olympics
World,IRS: Rose Owes Nearly \$1M in Unpaid Taxes
Sci/Tech,Spectrum of Stormy Saturn
Sci/Tech,DNA Project May Reunite Adoptees with their Parents
Sci/Tech,Drag-and-drop flaw mars Microsoft's latest update
Sci/Tech,Report: Consumers tuning in to plasma TVs
Sci/Tech,'Doom 3' Game Unlikely for Xbox This Year - Id CEO (Reuters)
Sci/Tech,Federal Court Rules for P2P Networks (NewsFactor)
Sci/Tech,"Apple Recalls 28,000 PowerBook Batteries Due to Overheating Concern (NewsFactor)"
Sci/Tech,Nokia Taps Ex-Coke Exec for Branding Help (NewsFactor)
Sci/Tech,Microsoft Gets Good Grades on SP2 (NewsFactor)
Sci/Tech,The CRM Money Pit - Part 4 (NewsFactor)
Sci/Tech,BlackBerry in Sync with Apple (NewsFactor)
Sports,Dolphins Ask Williams for  #36;8.6 Million (AP)
Sci/Tech,'Doom 3' Game Unlikely for Xbox This Year - Id CEO
Sports,Reds' Graves Placed on DL With Sore Back (AP)
Sports,"Swimming: Phelps Wins Fifth Gold, Seventh Medal"
World,Sadr Militia Still Controls Iraq Shrine -- Witnesses
World,Vagrant Killings Raise Fears of Brazil Death Squad
World,Belgium impounds Ukraine plane
World,Bush Aide Says White House Is Not Linked to Anti-Kerry Ad
World,Kerry Says Bush Ignores 'Average Folks'
Sci/Tech,"Online sales continue to rise, up 23.1 from a year ago"
Sci/Tech,J.D. Edwards users still aren't sold on PeopleSoft's takeover
Sci/Tech,Possible security breach seen at AOL
Sci/Tech,Former Microsoft COO: Intelligence overhaul means crushing 'fiefdoms'
Sci/Tech,Reports criticize DHS for lack of progress on IT
Sci/Tech,Oracle moves to monthly patching schedule
Sci/Tech,New Download.Ject worm variant appears
Sci/Tech,Reporter's notebook: HP World users disdain offshore support move
Sci/Tech,Tech industry split in its political donations
Sci/Tech,More money for fuel cells
World,Phelps Adds New Olympic Triumph (Reuters)
World,N.S. submariner recalls harrowing experiences in career spent underwater (Canadian Press)
World,White House Says It Is Not Behind Attack Ads (Reuters)
World,IRS: Rose Owes Nearly \$1M in Unpaid Taxes
World,Stocks Edge Higher As Oil Prices Fall
Business,FCC Issues Rate Freeze for Phone Networks (Reuters)
Business,Stocks Jump as Oil Retreats from High
Business,General Growth to Buy Rouse for \$7.2 Bln
Business,United Air Raises Fuel Surcharge
Business,SEC Proxy Access Plan Stalled
World,Kerry takes legal action against Vietnam critics (AFP)
Business,U.S. Treasury Prices Edge Lower
Sci/Tech,Briefly: More money for fuel cells
Business,UAL Wins OK for Exclusivity Extension (Reuters)
World,Gas stoppage may have caused deadly Belgian blast: TV report (AFP)
Business,UAL Wins OK for Exclusivity Extension
Sports,McGahee Pressures Bills
Sci/Tech,Briefly: Glitches hit some EarthLink-hosted sites
Sci/Tech,A chat check list for IT managers
Sci/Tech,Enterprise IM: Dangerous by default
Sci/Tech,Reining in public IM
Sports,"Kennedy, Kendall Suspended for Brawling (AP)"
Sports,Tennessee May Start Freshman QB in Opener (AP)
Business,Boeing Sees EU Agreeing to End Launch Aid
Sports,Bekele Succeeds Mentor Gebrselassie
World,Zimbabwe moves to restrict NGOs
World,9/11 Commission Formally Disbands
World,Militia Offers to Cede Control of Shrine
World,Sanofi-Aventis becomes world's third-largest pharmaceutical company (AFP)
Sports,Team USA Says Labor Woes Won't Affect Cup (AP)
World,Judge gives lawyers more time to review evidence in Regina election challenge (Canadian Press)
Business,Ex-Enron CEO Seeks Separate Trial
Business,Arch Coal: Triton Acquisition Completed
World,FCC Puts Hold on Wholesale Phone Rates (AP)
World,"Nicaragua, Taiwan open trade talks (AFP)"
Sci/Tech,Linux Desktop Needs PC Vendor Support (Ziff Davis)
Sports,Rose Takes Big Tax Hit
Sports,Dolphins Want a Refund From Williams
Sports,Rain Hampers Play at NEC Invitational
Sci/Tech,Possible security breach seen at AOL
Business,Ex-Enron CEO Seeks Separate Trial (Reuters)
Sports,Moore Reaches U.S. Amateur Semifinals (AP)
Business,GM's CEO Pours Cold Water on Gas Tax Hike
Sports,Major League Approves Baseball Channel for TV
World,U.S. Arrests Two in Hamas Financing Case
World,Chilean Judge Questions Pinochet on Riggs Money
World,Agent: Rose Making Payments on Back Taxes
World,Courtney Love Pleads Innocent to Assault
Sci/Tech,Is VoIP just chump change?
Sports,Major League Approves Baseball Channel for TV (Reuters)
World,Beleaguered CNE hoping for banner summer as others long for days gone by (Canadian Press)
Sci/Tech,Judge Revokes Mine Permit in Florida (AP)
Business,Court Won't Halt Arch Coal's Triton Bid
World,Fischer fails to halt deportation
Sports,U-Md. Locks Up Friedgen
Business,Intelligence everywhere
Business,"Sun goes down, Empire blows up"
Sci/Tech,Javalobby removes Java specs at Suns request
Sci/Tech,FCC sets interim network-sharing rules
World,Paes-Bhupathi lose to Ancic-Ljubicic (Reuters)
World,NYC Denies All Central Park Rally Permits (AP)
World,Volunteer Links Anti-Kerry Flier to GOP (AP)
Business,30 More Days of Exclusivity for UAL OK'd (Reuters)
World,Bombs Prompt Call for U.N. Afghan Pullout (AP)
Sports,Greek Drugs Embarrassment Overshadows Phelps
World,Pinochet probed on bank accounts
Sci/Tech,A Sense of Security
Sports,"After Five Golds, Phelps Bows Out of Relay (AP)"
Sports,Mets' McEwing Probably Lost for Season (AP)
Business,Chain Store Sales Rise in the Latest Week
Sports,Four Tied for Lead at Reno-Tahoe Open (AP)
World,"Candidate, Party Spending Tops  #36;1 Billion (AP)"
World,"Kerry, Bush Escalate Battle Over Vietnam Ads (Reuters)"
World,Reform Advocates in China Hope for a Birthday Present
World,U.S. Now Said to Support Growth for Some West Bank Settlements
Sports,Pinsent bids for glory
World,India clears cricket team to begin Bangladesh tour (Reuters)
Sci/Tech,Court: Cos. Not Liable for Online Abuses (AP)
World,Hezbollah-Linked Network Ordered to Comply (AP)
World,"Iranian diplomat, Egyptian charged over assassination plot (AFP)"
Sci/Tech,Moveon.org subscriber-data leaked through search
Business,An Oil Shock That Could Be an Economic Stimulus in Disguise
Business,Reshaping a Reshaper of Landscapes
Sci/Tech,'Doom 3' Game Unlikely for Xbox This Year - id CEO
Sci/Tech,'Doom 3' Game Unlikely for Xbox This Year - id CEO (Reuters)
World,Sen. Kerry Nearly Matches Bush's Fund-Raising (Reuters)
Sci/Tech,Check your marital status
World,Bearhug Politics: Careful Steps to a New Bush-McCain Alliance
Sci/Tech,Google Faces Challenge of Public Company Status (washingtonpost.com)
Sports,Athletics Pound Devil Rays 9-5 (AP)
World,Dutch Clear Van Gogh Slay Suspects (AP)
Sci/Tech,Google Faces Challenge of Public Company Status
Sports,Schilling Shines As Red Sox Rout White Sox (AP)
World,GI Jenkins Said Willing to Face U.S. Tribunal -Media (Reuters)
World,Clashes Slow as Cleric's Grip on Mosque Seems to Slip
Sports,Rookie Leads Falcons Past Vikings 27-24 (AP)
Sports,Phillies Top Brewers 4-2 to Stop Skid (AP)
Sports,Davenport Advances at Ohio Tournament (AP)
Sports,Ortiz Stifle Yankees
World,Wide U.S. Inquiry Into Purchasing for Health Care
World,Musharraf #39;s one-way deal is just the ticket
Sports,Cards Top Pirates 5-3 to Sweep Twinbill (AP)
World,Japan Tropical Storm Death Toll Hits 13 (AP)
Business,Stocks End Week on High Note
Business,Hundreds Report Watch-List Trials
World,N. Irish deal hangs on IRA arms photos
Business,Prominent Eatery Seeks Chapter 11 Protection
World,"Tensions Escalate Between Israel, Iran"
Sports,NBA Jazz activate Spanish guard Lopez (AFP)
Sports,Eagles Beat Ravens 26-17 but Lose Runner (AP)
World,Four Dead After Attack on Homeless Man (AP)
Sports,"Expos Lose Johnson, Armas to Injuries (AP)"
World,"Chavez Urges Foes to Accept Defeat, Scoffs at Fraud"
Business,"With Boxing Show, Fox Makes Quick Move, but Judge Reacts"
Sports,"Yankees Are Powerless, and Stadium Was, Too"
Business,2 Ex-I.R.S. Lawyers' Licenses Suspended for Misconduct
World,Chinese Advocates of Reform Seek Help From Deng's Spirit
Sports,Dolphins Want Pay Back
Sports,Cink Leads Soaking NEC
Sports,AND1 Mix Tape Tour Hop-Steps Into MCI Tonight
Sports,Austin Relieved His Head Wasn't Shouldering a Problem
Sports,Towers Stumps O's Again
World,Corelli author loses plot in summerhouse theft (Reuters)
World,Sadr Militiamen Still in Control of Iraq Shrine
Sports,McGahee: Play Me or Trade Me
Sports,Ortiz Stones Yankees
Sci/Tech,Moveon.org subscribers exposed
World,Vietnam Vets in Hanoi Back Kerry with T-Shirts (Reuters)
Business,U.S. Begins Criminal Probe on Riggs-Paper
Business,U.S. Begins Criminal Probe on Riggs-Paper (Reuters)
World,"Phelps Gets Five Golds, Then Steps Aside"
Sports,Dodgers Beat the Braves 3-2 in 11 Innings (AP)
Sports,Pettersen in Lead at Wendy's LPGA (AP)
Business,Oil Price Comes Close to \$50 but Then It Stages a Retreat
Business,Grokster Wins Legal Victory over Copyrights
Business,Good for Google
Business,Rival has deal for mall owner
Business,FCC Adds 6 Months to Local Phone Line Rules
Business,US Begins Criminal Probe on Riggs-Paper
Business,Dallas firm interested in buying Cyberonics
Business,Sir Martin Sorrell  #39;very impressed #39; with US group
Business,Arch Coal completes Triton deal
Business,Bay Street gets a boost from gold and technology sectors
Business,Oil Prices Inch Back Down
Business,Airways pilots extend talks
Business,Viacom could consider acquiring Midway Games
Business,Marvell Posts 54 Increase in Earnings
Sports,Woods looks like he #39;ll stay No. 1 _ for now
Sports,Bekele begins reign as world #39;s distance-running king
Sports,"Mets give up six in first, can #39;t struggle back"
Sports,"Compete against your friends, SI experts and celebrities in this pro football pickoff"
Sports,Cubs Blast Six Homers in Astros Mauling
Sports,Rangers beat Royals for seventh straight
Sports,Overton beats hometown favorite
Sports,Ortiz shines in Angels win
Sports,Major League Baseball to Create Channel
Sports,Schaub Rallies Falcons
Sports,Red Sox Bash White Sox 10-1 (AP)
Sports,The Bad Overshadows Good in Eagles Win (AP)
Sci/Tech,IE Flaw Affects Windows XP SP2 Systems
Sci/Tech,Hollywood to grab stardust for Nasa
Sci/Tech,Apple Announces Voluntary Recall of Powerbook Batteries
Sci/Tech,Learning to write with classroom blogs
Sci/Tech,E-Commerce Sales Rise in Second Quarter
Sci/Tech,Lonely town holds view of space #39;s deep corners
Sci/Tech,Moveon.org subscriber-data leaked through search
Sci/Tech,"Good-looking, Lightweight  #39;Push-to-Talk #39; Phone for Business Users"
Sci/Tech,AMD using strained silicon on 90-nanometer chips
Sci/Tech,Phone company replies to man 28 years later
Sci/Tech,Blackberry in sync with Apple computers
World,Australian opposition leader released from hospital (AFP)
World,Kerry Tries to Counter Impact of Criticism
World,Captors treat journalist well #39;
World,Lab finds deadly H5N1 virus in pigs in China
World,Maoist blockade of Kathmandu continues
World,Make aid a demilitarized zone
World,Muslim Nations Urged to Meet About Najaf by Iran Leader
World,Fire stops production at Bridgestone #39;s biggest tire plant in Japan
World,"Australia Considers Stockpiling Crude Oil, Australian Reports"
World,China Invokes Deng to Send Tough Taiwan Message
Sports,Utes D coordinator has two offers
World,Expedition Aims to Find Lost Slave Ship (AP)
Business,Rate of oil exploration slows
Business,New Fan Pier owners may take on partners
Business,Firm buys Rouse in \$12.6b deal
Business,Changes at the Herald
Business,Mass. job growth highest since  #146;00
Business,Giving back in a big way
Sports,NL notables
Sports,Rose owes almost \$1m in back taxes
Sports,Car accident can't keep coach away
Sports,Red Sox: Burly effort
Sports,Ralston's position? Whatever it takes
Sports,Everhart won't join Huggins
Sports,Eagles apply some more polish
Sports,Toms not all wet at NEC
Sports,Mass. girls defend
World,"As Milosevic turns 63, UN judges seek to get trial back on track"
World,Israel #146;s AG suggests changes to barrier
World,Hostage says he #146;s being treated well
Sports,Capital professor lands lead role with UK Athletics
World,"On Tape, Abducted Reporter Says He's OK (AP)"
World,Fourth gold for Pinsent
World,"Across New York, a Death Penalty Stuck in Limbo"
Sci/Tech,Golden mask sensational #39;
Sports,"Greece Soul Searches, Phelps Nears Record"
World,Liquor Inhaler Debuts Alcohol-Free in NYC
Sports,Fourth gold for Pinsent
Sports,Phelps #39; gesture is worth a million
Sports,I couldn #39;t stop Woodgate - Newcastle boss Robson
Sports,Greek jubilation no myth in  #39;Peg
Sports,Sox cruise past Chicago
Sports,Wily Devers snares spot in semifinals
Sports,Wambach #39;s boot boosts US into semifinals
Sports,"In a flash, Escobedo's dream is over"
Sports,'Style' scores in Spa feature
Sports,Different world
Sports,Vendt's quest quashed
Sports,Cannons find target in rout
Sports,Heyl's spirits still afloat
Sports,Japan's Ueno pitcher perfect vs. China
Sports,"Distant memory in 10,000"
Sports,"Wadlow, Spaulding finally get a windfall"
Sports,"For Hall, a splash and dash to another gold"
Sports,"Greece Soul Searches, Phelps Nears Record"
Sports,Power outage wreaks havoc in Bronx
Sports,Emmons gives it best shot
Sports,Mets lose Trach in field
Sports,NL notables
World,Murder police carry out searches
Sci/Tech,Report asserts Kazaa makes the rules
Sci/Tech,Congress Wants Rights Board
Sci/Tech,Apple in iTunes.co.uk cybersquatting row
Sci/Tech,"You're Athletes, Not Journalists"
World,Truckers defy Kathmandu blockade
World,Accused Hamas Leader Denies U.S. Charges
Sci/Tech,Riddick's mixed bag of tricks
Sci/Tech,AMD adds power saving at the high end
World,Malaysia testing 3 people for bird flu; says outbreak isolated
World,Iraqi captors to  #39;free US journalist #39;
World,Truckers defy Kathmandu blockade
World,Russian Cossacks ride for country again
World,Abductions in Iraq catch Nepal government off guard
World,"As Milosevic turns 63, UN judges seek to get trial back on track"
World,Seven separatist rebels killed in restive Aceh
World,Policeman Killed as Nepal Siege Grips Capital (Reuters)
World,Young French woman murdered in London park (AFP)
World,HK heat 'risks bacteria growth'
World,Militiamen begin to leave Shi #146;te shrine
World,US Changes West Bank Policy to Help Sharon: NYTimes (Reuters)
World,Iran Hangs Three Drug Smugglers in Public - Paper (Reuters)
World,US Changes West Bank Policy to Help Sharon: NYTimes
World,Iran Hangs Three Drug Smugglers in Public - Paper
World,UN airlifts food to Darfur town
World,Jackson search 'ignored warrant'
World,Pakistani Forces Attack Terrorist Lairs
Business,Week Ahead: Stocks May Rally if Oil Eases (Reuters)
Business,Oil Unlikely to Knock Fed Off Rate Plan (Reuters)
Business,Week Ahead: Stocks May Rally if Oil Eases
World,Two Blasts Hit Northwest Spain After ETA Warnings
World,German Police Detain 10 Neo-Nazis Before Hess March
World,UN staff call for Afghan pullout
World,"Two bombs explode in Spain's northwest, ETA suspected (AFP)"
Sci/Tech,Multifunction Devices Draw Back-To-School Crowd (Reuters)
Sports,Woods May Stay No. 1 - for Now (AP)
Business,Away on Business: Making a Difference
Sci/Tech,Multifunction Devices Draw Back-To-School Crowd
Sci/Tech,Online Satirists Pull No Punches on U.S. Election (Reuters)
World,Spain bombs 'follow Eta warning'
World,Phelps Bows Out With Magnanimous Gesture
World,Bombs Explode at Rally in Bangladesh
Sports,Judges Suspended
Sports,Crawford Wins 100 Preliminaries
Sports,U.S. Beats Australia
Sports,Pinsent Wins Fourth Gold
Sports,Ainslie clinches Finn gold
World,Blast at Bangladesh Opposition Meeting Kills 4
World,Two Blasts Hit Northwest Spain After ETA Warnings
World,Blast hits Bangladesh party rally
World,Blast at Bangladesh Opposition Meeting Kills 4 (Reuters)
