y,X
Business,Wall St. Bears Claw Back Into the Black (Reuters)
Business,Carlyle Looks Toward Commercial Aerospace (Reuters)
Business,Oil and Economy Cloud Stocks' Outlook (Reuters)
Business,Iraq Halts Oil Exports from Main Southern Pipeline (Reuters)
Business,"Oil prices soar to all-time record, posing new menace to US economy (AFP)"
Business,"Stocks End Up, But Near Year Lows (Reuters)"
Business,Money Funds Fell in Latest Week (AP)
Business,Fed minutes show dissent over inflation (USATODAY.com)
Business,Safety Net (Forbes.com)
Business,Wall St. Bears Claw Back Into the Black
Business,Oil and Economy Cloud Stocks' Outlook
Business,No Need for OPEC to Pump More-Iran Gov
Business,Non-OPEC Nations Should Up Output-Purnomo
Business,Google IPO Auction Off to Rocky Start
Business,Dollar Falls Broadly on Record Trade Gap
Business,Rescuing an Old Saver
Business,Kids Rule for Back-to-School
Business,"In a Down Market, Head Toward Value Funds"
Business,US trade deficit swells in June
Business,Shell 'could be target for Total'
Business,Google IPO faces Playboy slip-up
Business,Eurozone economy keeps growing
Business,Expansion slows in Japan
Business,Rand falls on shock SA rate cut
Business,Car prices down across the board
Business,South Korea lowers interest rates
Business,Google auction begins on Friday
Business,HP shares tumble on profit news
Business,Mauritian textile firm cuts jobs
Business,Chad seeks refugee aid from IMF
Business,Japan nuclear firm shuts plants
Business,Veteran inventor in market float
Business,Saudi Arabia to open up oil taps
Business,Saudi phone sector gets \$1bn lift
Business,Indians fill rail skills shortage
Business,Steady as they go
Business,"Google IPO: Type in 'confusing,' 'secrecy'"
Business,A bargain hunter's paradise
Business,Researchers seek to untangle the e-mail thread
Business,Microsoft Corp. 2.0: a kinder corporate culture
Business,Letters
Business,Somewhere between gleam and gloom
Business,Technology company sues five ex-employees
Business,Grant to aid Lynn Central Square
Business,State grant to aid Lynn; Bank gives Salem \$10k
Business,A New Legal Chapter for a 90's Flameout
Business,"Will Russia, the Oil Superpower, Flex Its Muscles?"
Business,"Switching Titles, if Not Gears, at Dell"
Business,For Sale: The Ultimate Status Symbol
Business,Quality Gets Swept Away
Business,Making Your Insurer Pay
Business,Delightful Dell
Business,Chrysler's Bling King
Business,What's Cool In the Pool ... ... And Hot On the Deck
Business,The Age of Doom
Business,Hip Hop's Online Shop
Business,Stoking the Steamroller
Business,Coming to The Rescue
Business,The New Customers Are In Town
Business,"Barrel of Monkeys, 2004 Edition: Notes on Philippine Elections"
Business,Oldsmobile: The final parking lot
Business,"Not All Jobs Belong To The White Man: Asian Minorities, Affirmative Action, And The Quest For Parity At Work"
Business,"Downhome Pinoy Blues, Intersecting Life Paths, and Heartbreak Songs"
Business,The Real Time Modern Manila Blues: Bill Monroe Meets Muddy Waters in the Orient
Business,Best Asian Tourism Destinations
Business,What are the best cities for business in Asia?
Business,IT alligator tales
Business,IT Myth 5: Most IT projects fail
Business,BEA grabs CA exec to head product group
Business,Autodesk tackles project collaboration
Business,U.K.'s NHS taps Gartner to help plan \$9B IT overhaul
Business,Play Boys: Google IPO a Go Anyway
Business,More Big Boobs in Playboy
Business,Dutch Firm Beats Apple to Punch
Business,HP to Buy Synstar
Business,A Personal Operator From Verizon
Business,Paid Search Growth May Slow
Business,Fark Sells Out. France Surrenders
Sci/Tech,"'Madden,' 'ESPN' Football Score in Different Ways (Reuters)"
Sci/Tech,Group to Propose New High-Speed Wireless Format (Reuters)
Sci/Tech,AOL to Sell Cheap PCs to Minorities and Seniors (Reuters)
Sci/Tech,Companies Approve New High-Capacity Disc Format (Reuters)
Sci/Tech,Missing June Deals Slow to Return for Software Cos. (Reuters)
Sci/Tech,Hacker Cracks Apple's Streaming Technology (AP)
Sci/Tech,European Download Services Go Mobile (Reuters)
Sci/Tech,Open Source Apps Developer SugarCRM Releases Sugar.Sales 1.1 (TechWeb)
Sci/Tech,Oracle Sales Data Seen Being Released (Reuters)
Sci/Tech,Sun's Looking Glass Provides 3D View (PC World)
Sci/Tech,Apple to open second Japanese retail store this month (MacCentral)
Sci/Tech,Charley's Force Took Experts by Surprise (AP)
Sci/Tech,"Science, Politics Collide in Election Year (AP)"
Sci/Tech,Building Dedicated to Columbia Astronauts (AP)
Sci/Tech,Russian Cargo Craft Docks at Space Station (AP)
Sci/Tech,Bangkok's Canals Losing to Urban Sprawl (AP)
Sci/Tech,"T. Rex Had Teen Growth Spurt, Scientists Say (Reuters)"
Sci/Tech,Gene Blocker Turns Monkeys Into Workaholics - Study (Reuters)
Sci/Tech,Dolphins Too Have Born Socialites (Reuters)
Sci/Tech,"What's in a Name? Well, Matt Is Sexier Than Paul (Reuters)"
Sci/Tech,UK Scientists Allowed to Clone Human Embryos (Reuters)
Sci/Tech,"Russian Alien Spaceship Claims Raise Eyebrows, Skepticism (SPACE.com)"
Sci/Tech,"Comets, Asteroids and Planets around a Nearby Star (SPACE.com)"
Sci/Tech,Perseid Meteor Shower Peaks Overnight (SPACE.com)
Sci/Tech,Redesigning Rockets: NASA Space Propulsion Finds a New Home (SPACE.com)
Sci/Tech,Studies Find Rats Can Get Hooked on Drugs (AP)
Sci/Tech,NASA Chief: 'Let's Go Save the Hubble' (SPACE.com)
Sci/Tech,Armadillo Aerospaces X Prize Prototype Crashes (SPACE.com)
Sci/Tech,Prairie Dog Won't Be on Endangered List (AP)
Sci/Tech,Hubble Trouble: One of Four Instruments Stops Working (SPACE.com)
Sci/Tech,Invasive Purple Weed May Meet Its Match (AP)
Sci/Tech,New NASA Supercomputer to Aid Theorists and Shuttle Engineers (SPACE.com)
Sci/Tech,Ants Form Supercolony Spanning 60 Miles (AP)
Sci/Tech,Viewer's Guide: Perseid Meteor Shower Peaks Aug. 11-12 (SPACE.com)
Sci/Tech,Rescuers Free Beached Whale in Brazil (AP)
Sci/Tech,Red-Footed Falcon Sighted in Mass. (AP)
Sci/Tech,Weak Version of Most Powerful Explosions Found (SPACE.com)
Sci/Tech,Simultaneous Tropical Storms a Rarity (AP)
Sci/Tech,NASA's Genesis Spacecraft Adjusts Course (AP)
Sci/Tech,"Earth is Rare, New Study Suggests (SPACE.com)"
Sci/Tech,Scientists Probe Pacific for Dead Zone (AP)
Sci/Tech,"Life on Mars Likely, Scientist Claims (SPACE.com)"
Sci/Tech,India Rethinks Plan to Send Man to Moon (AP)
Sci/Tech,Natural Sunblock: Sun Dims in Strange Ways (SPACE.com)
Sci/Tech,Website Lets Users Scout the Red Planet from Home (SPACE.com)
Sci/Tech,Appeal Rejected in Trout Restoration Plan (AP)
Sci/Tech,Explore the Many Colors of Stars (SPACE.com)
Sci/Tech,Britain Grants Human Cloning License (AP)
Sci/Tech,The Next Great Space Race: SpaceShipOne and Wild Fire to Go For the Gold (SPACE.com)
Sci/Tech,"Growth, Mortality of T. Rex Gets Clearer (AP)"
Sci/Tech,Space Science Pioneer Van Allen Questions Human Spaceflight (SPACE.com)
Sci/Tech,China Begins Manned Space Flight Countdown (AP)
Sci/Tech,Sunspot Grows to 20 Times Size of Earth (SPACE.com)
Sci/Tech,Japanese Lunar Probe Facing Delays (AP)
Sci/Tech,Pollutants From Asia Appear on East Coast (AP)
Sci/Tech,Vietnam's Citadel Vulnerable to Weather (AP)
Sci/Tech,U.S. Barred From Weakening Dolphin Rules (AP)
Sci/Tech,Canadian Robot a Candidate to Save Hubble (AP)
Sci/Tech,Cave Explorers Discover Pit in Croatia (AP)
Sci/Tech,Aquarium Reviews Death of Dolphin (AP)
Sci/Tech,Scientists Seek Better Way to Measure Rain (AP)
Sci/Tech,Wash. State Team's Private Rocket Explodes (AP)
Sci/Tech,Nevada Ponders Superfund Status for Mine (AP)
Sci/Tech,Indictments Using DNA on Rise Nationally (AP)
Sci/Tech,Southeast Coast Sees Fewer Turtle Nests (AP)
Sci/Tech,Company Said to Be Ready to Clone Pets (AP)
Sci/Tech,Deep-Sea Vessel Puts Ocean Floor in Reach (AP)
Sci/Tech,Chorus Frog Found Croaking in Virginia (AP)
Sci/Tech,Expedition to Probe Gulf of Mexico (AP)
Sci/Tech,Feds Accused of Exaggerating Fire Impact (AP)
Sci/Tech,New Method May Predict Quakes Weeks Ahead (AP)
Sci/Tech,Marine Expedition Finds New Species (AP)
Sci/Tech,Annual Study Finds Rise in Beach Closures (AP)
Sci/Tech,Pacific May Be Seeing New El Nino (AP)
Sci/Tech,Cassini Spacecraft Sees Saturn Lightning (AP)
Sci/Tech,Poachers Putting Endangered Rhinos at Risk (AP)
Sci/Tech,Experts Downplay Texas Shark Attacks (AP)
Sci/Tech,Study Says Birds Feed Other Birds' Young (AP)
Sci/Tech,Canadian Team Joins Rocket Launch Contest (AP)
Sci/Tech,Universities to Build Largest Telescope (AP)
Sci/Tech,Mauritanian Capital Battles Locust Swarm (AP)
Sci/Tech,Customers of Telco Companies Face Privacy Breach
Sci/Tech,"Mozilla To Add Support For XForms, World Yawns"
Sci/Tech,Junk faxes to be legalized as  quot;opt-out? quot;
Sci/Tech,Biased Against Whom?
Sci/Tech,The Visual World of Michel Gondry
Sci/Tech,The Austral-Asian Strike Fighter
Sci/Tech,Insecurity: (Or Why Americans Aren't Feeling The Recovery)
Sci/Tech,The Great K5 Limerick Contest
Sci/Tech,RuntimeProperties... Reflection from System Properties
Sci/Tech,Thank You IBM!
Sci/Tech,"LinuxWorld, IDs, and Privacy"
Sci/Tech,My Blog as a Time Machine
Sci/Tech,NTP in Debian
Sci/Tech,Pretty Log4J
Sci/Tech,Saudis: Bin Laden associate surrenders
Sci/Tech,Mozilla Exceptions (mexception)
Sci/Tech,Ron Regan Jr is My Kinda Guy
Sci/Tech,Al Qaeda member surrenders
Sci/Tech,Mission Accomplished!
Sci/Tech,Java3D - Half Right
Sci/Tech,Reverse Psychology
Sci/Tech,Kerry's Disgusting Ad
Sci/Tech,What would Baby Jesus Think?
Sci/Tech,Americans and Freedom
Sci/Tech,Why Windows isn't Unix
Sci/Tech,"Microsoft, IE and Bloat"
Sci/Tech,"DRM is doubleplus good for business, Congress advised"
Sci/Tech,HP: The Adaptive Enterprise that can't adapt
Sci/Tech,Buffy the Censor Slayer
Sci/Tech,Ashlee Vance: the readers have spoken
Sci/Tech,&lt;em&gt;El Reg&lt;/em&gt; pledges to name BSA antipiracy weasel
Sci/Tech,Wireless net to get speed boost
Sci/Tech,Watchdog rules over broadband
Sci/Tech,GameBoy mini-games win prize
Sci/Tech,Microsoft takes down SP2 sharers
Sci/Tech,Long-awaited Doom 3 hits the UK
Sci/Tech,Britons embrace digital lifestyle
Sci/Tech,PlayStation potential to learning
Sci/Tech,'Invisible' technology for Olympics
Sci/Tech,Satellite boosts Olympic security
Sci/Tech,3D holograms to crack forgeries
Sci/Tech,Video games 'good for children'
Sci/Tech,Fake goods tempting young adults
Sci/Tech,Catwoman far from perfect
Sci/Tech,"'Madden,' 'ESPN' Football Score in Different Ways"
Sci/Tech,AOL to Sell Cheap PCs to Minorities and Seniors
Sci/Tech,Microsoft to Introduce Cheaper Version of Windows
Sci/Tech,Companies Approve New High-Capacity Disc Format
Sci/Tech,Missing June Deals Slow to Return for Software Cos.
Sci/Tech,Microsoft Upgrades Software for Digital Pictures
Sci/Tech,Google to Pay Yahoo to Settle Patent Dispute
Sci/Tech,A Digital Doctor Treats Computer Contamination
Sci/Tech,'SP2' a Must With XP Use
Sci/Tech,Putting Your Own Stamp On All Your Parcels
Sci/Tech,Internet Challenges Face-to-Face Mingling
Sci/Tech,Forecast: Plenty of Activity On the Weather Blog Front
Sci/Tech,Google Starts Auction
Sci/Tech,Bids Placed Despite Mixed News
Sci/Tech,Antitrust Lawyer Takes Helm at FTC
Sci/Tech,GAO Calls Stryker Too Heavy for Transport
Sci/Tech,BioVeris Settles 2 Lawsuits Against Chief Executive's Son
Sci/Tech,Google: Now Playboy's Latest Bunny
Sci/Tech,EBay Buys Stake in Craigslist
Sci/Tech,Blog Interrupted
Sci/Tech,Hungry world 'must eat less meat'
Sci/Tech,Hopes soar for solo record plane
Sci/Tech,Arctic team reaches destination
Sci/Tech,Shuttle camera to watch fuel tank
Sci/Tech,Hubble peers at celestial bubble
Sci/Tech,Bacteria gives coral orange glow
Sci/Tech,Honey bees close museum
Sci/Tech,Clouds dash Perseids show
Sci/Tech,Worms may slow Parkinson's
Sci/Tech,Nasa help for stem cell study
Sci/Tech,TB test to slash infection rates
Sci/Tech,Scientists given cloning go-ahead
Sci/Tech,Vandals damage bird reserve
Sci/Tech,Heat waves set to become 'brutal'
Sci/Tech,Monkeys test 'hardworking gene'
Sci/Tech,Hearing clue to whale evolution
Sci/Tech,News: NASA Extends TRMM Operations Through 2004 Hurricane Season
Sci/Tech,News: Climate Change Could Doom Alaska's Tundra
Sci/Tech,News: How Strongly Does the Sun Influence the Climate?
Sci/Tech,News: New England Forests at Greater Risk from Air Pollution
Sci/Tech,"News: Warmer Weather, Human Disturbances Interact to Change Forests"
Sci/Tech,News: Duke Study Disputes Idea that Trees Can 'Relocate' Quickly in Response to Climate Change
Sci/Tech,"News: Droughts Like 1930s Dust Bowl May Have Been Unexceptional in Prehistoric Times, New Study Suggests"
Sci/Tech,News: New Study to Investigate Demise of Coral Reef Ecosystems
Sci/Tech,Natural Hazards: Typhoon Rananim
Sci/Tech,Horseflies and Meteors
Sci/Tech,Spinning Brains
Sci/Tech,What Neil   Buzz Left on the Moon
Sci/Tech,"Voyager 1, Prepare for Action"
Sci/Tech,Saturn Hailstorm
Sci/Tech,Dino-Size Spurt: T. Rex Teens Gained 5 Pounds a Day
Sci/Tech,Fossils Show How Whales Evolved to Hear Underwater
Sci/Tech,"Real ""Danny Deckchairs"" Soar With Just a Seat and Some Balloons"
Sci/Tech,"""Unusually Good"" Meteor Shower Expected Tonight"
Sci/Tech,"""Monster"" Waves Suprisingly Common, Satellites Show"
Sci/Tech,"Ancient Olympians Followed ""Atkins"" Diet, Scholar Says"
Sci/Tech,U.S. Warrior Arms Africans to Hunt Sudanese Poachers
Sci/Tech,"Ancient Olympics Mixed Naked Sports, Pagan Partying"
Sci/Tech,Travel Column: Offsetting Air Travel's Greenhouse Impact
Sci/Tech,"Magma Surge Moves Nevada Mountain, Study Says"
Sci/Tech,266 Chimps From Lab Adopted by Florida Refuge
Sci/Tech,Locusts Inspire Technology That May Prevent Car Crashes
Sci/Tech,Progress Supply Ship Docks with Space Station
Sci/Tech,Building Dedicated to Space Shuttle Columbia Astronauts
Sci/Tech,Undersea Habitat Becomes Experimental Space Hospital
Sci/Tech,How Mars Fooled the World
Sci/Tech,Chandra Catches Early Phase of Cosmic Assembly
Sci/Tech,Hubble Peers Inside a Celestial Geode
Sci/Tech,Saturn's Moon Titan: Prebiotic Laboratory
Sci/Tech,Sharpest Image Ever Obtained of a Circumstellar Disk Reveals Signs of Young Planets
Sci/Tech,Chandra Celebrates Five Years of Scientific Breakthroughs
Sci/Tech,Some Globular Clusters May Be Leftovers From Snacking Galaxies
Sci/Tech,India Rethinks Plan for Manned Moon Mission
Sci/Tech,Cluster Finds Giant Gas Vortices at the Edge of Earths Magnetic Bubble
Sci/Tech,Saturn's Moon Titan: Planet Wannabe
Sci/Tech,Knocking on Heaven's Door
Sci/Tech,China Begins Countdown for Next Manned Space Flight
Sci/Tech,Trajectory Maneuver Brings Genesis Spacecraft Closer to Home
Sci/Tech,Japanese Lunar Probe Mission Facing Delays
Sci/Tech,Progress Cargo Ship for ISS Launched From Russia
Sci/Tech,The Annual Perseid Meteor Shower
Sci/Tech,NASA Approves Robotic Hubble Repair Mission
Sci/Tech,What Is a Comet Made Of?
Sci/Tech,Dying Star Goes Out With a Ring
Sci/Tech,Lost Sleep Leads to Health Problems
Sci/Tech,Which Diet is Best? The One That Works for You
Sci/Tech,Clouds are Cooler than Smoke
Sci/Tech,Last Year's Flu Shot Imperfect But Effective
Sci/Tech,Olympics Could Call Out the Couch Potatoes
Sci/Tech,Skateboarding Offers a Tough Workout
Sci/Tech,Rats May Help Unravel Human Drug Addiction Mysteries
Sci/Tech,Sting of Bug Bites Can Linger Into Adulthood
Sci/Tech,FDA Warns of Terrorist Prescription Drug Tampering
Sci/Tech,Scientists Probe Pacific Ocean for Dead Zones
Sci/Tech,Simultaneous Tropical Storms are Very Rare
Sci/Tech,Deaths Raise Fears Over Stomach Stapling Surgery
Sci/Tech,Growth and Mortality Details of T. Rex Get Clearer
Sci/Tech,Britain Approves Human Cloning
Sci/Tech,New Clot Preventer Saves Lives and Money
Sci/Tech,The Eyes Are the Window to Hypertension
Sci/Tech,Progress Is Made Battling Strep Germ
Sci/Tech,Fake Drug Sales Problematic in Mexico
Sci/Tech,New Allergy Vaccine Shows Promise
Sci/Tech,First Lady Bashes John Kerry's Pro Stem Cell Stance
Sci/Tech,Doctors Place Hope in Baby Pacemaker Devices
Sci/Tech,Vending Machines Making Room for Healthy Products
Sci/Tech,Getting beyond the next big thing
Sci/Tech,"If this is a tech rebound, pinch me"
Sci/Tech,Briefly: HP partners with 3G gear maker
Sci/Tech,Judge moves to unseal documents in Oracle case
Sci/Tech,Study: IT workers more optimistic
Sci/Tech,"California urged to use open source, VoIP"
Sci/Tech,Gartner: 'Steer away' from cheap Windows XP
Sci/Tech,Oracle expands midmarket ambitions
Sci/Tech,Taking the Microsoft Rorschach test
Sci/Tech,Earnings alert: BEA revenue rises amid turmoil
Sci/Tech,AMD starts shipping 90-nanometer chips
Sci/Tech,"Lenovo revenue grows, but problems persist"
Sci/Tech,Dell's second-quarter earnings meet expectations
Sci/Tech,"Tech market indeed soft, but HP woes one of a kind"
Sci/Tech,HP replaces three senior executives
Sci/Tech,"Meet the new boss, same as the old boss?"
Sci/Tech,IBM's mainframe momentum continues
Sci/Tech,Gateway alumnus resurfaces at HP
Sci/Tech,Security pro: Windows easier to 'own'
Sci/Tech,Securing the gold in Athens
Sci/Tech,Hacker takes bite out of Apple's iTunes
Sci/Tech,"Microsoft touts 'Sender ID' to fight spam, scams"
Sci/Tech,Begging for trouble on security
Sci/Tech,Microsoft's blast from the past
Sci/Tech,MSBlast suspect pleads guilty
Sci/Tech,Microsoft plugs hole in Exchange
Sci/Tech,PC security under fire
Sci/Tech,Flaw opens AOL chat software to intruders
Sci/Tech,HP partners with 3G gear maker
Sci/Tech,Cox speed boost leaves some members behind
Sci/Tech,Nortel wins Indian wireless contract
Sci/Tech,Mosquito software bites smart phones
Sci/Tech,Vonage hangs up on some callers
Sci/Tech,Group proposes faster Wi-Fi specification
Sci/Tech,Some VoIP calls being blocked
Sci/Tech,Covad tries an end run
Sci/Tech,FCC certifies Freescale ultrawideband technology
Sci/Tech,'Push to talk' meets Wi-Fi
Sci/Tech,PalmSource chairman to step down
Sci/Tech,Blu-ray Disc spec approved
Sci/Tech,iPod chipmaker plans stock offering
Sci/Tech,Sony zooms in with new TV tech
Sci/Tech,PalmOne to turn off wireless service
Sci/Tech,Apple puts edit tools in one basket
Sci/Tech,Microsoft wants to improve your image
Sci/Tech,DVD player profits down to \$1
Sci/Tech,"Sharp brings 3D to PCs, without the funny specs"
Sci/Tech,Report: Los Alamos lab needs better hardware inventory
Sci/Tech,Circuit City chooses Linux for cash registers in 600 stores
Sci/Tech,Training seen as way to counter offshoring
Sci/Tech,Missing June deals slow to return for software companies
Sci/Tech,"VoIP gaining ground, despite cost concerns"
Sci/Tech,Olympic IT security requires advance planning
Sci/Tech,BEA meets lowered expectations for Q2
Sci/Tech,Hunt for XP SP2 flaws seen in full swing
Sci/Tech,"Tools wrap: Sun, Javalobby, Infravio make moves"
Sci/Tech,Sender ID gains traction
Sci/Tech,"Storage, servers brings down HP results"
Sci/Tech,EBay takes stake in Craigslist
Sci/Tech,AMD starts shipping 90-nanometer chips to customers
Sci/Tech,FCC mobile spam rule doesn't cover some SMS
Sci/Tech,Benhamou will resign as chairman of PalmSource
Sci/Tech,Update: Google raises gavel for IPO auction Friday
Sci/Tech,Olympic-size security demands advance planning
Sci/Tech,EBay Buys into Craigslist
Sci/Tech,Is Microsoft's Firewall Secure?
Sci/Tech,Newest Ad-Aware Exposes Some Users
Sci/Tech,Trojan Bites Symbian Phones
Sci/Tech,ATI Brings Digital TV to Your PC
Sci/Tech,MSN Adds Movie Downloads and Rentals
Sci/Tech,Win XP Update: A Quiet Start
Sci/Tech,AOL Launches PC Line
Sci/Tech,Caregivers Carry Virtual Clipboard
Sci/Tech,Blaster Author Pleads Guilty
Sci/Tech,International Group Teams Against Spam
Sci/Tech,"Copiers Need Security, Too"
Sci/Tech,Intel Shows Wireless Transceiver
Sci/Tech,"AOL, Yahoo Add New Antispam Tools"
Sci/Tech,"Most Spam is Domestic, Study Says"
Sci/Tech,BlackBerries Play Politics
Sci/Tech,First Look at Quicken 2005
Sci/Tech,Dell Unveils Inexpensive Projector
Sci/Tech,'Insider' Information Puts City Blogs on the Map
Sci/Tech,"Judge Says Amazon, Toys 'R' Us Must Work Together"
Sci/Tech,Google IPO Moves Ahead Despite Playboy Interview
Sci/Tech,EBay Buys 25 Percent Stake in Craigslist Network
Sci/Tech,Biometrics Creeping Into Everyday Life for Americans
Sci/Tech,Dell Posts Another Quarter of Nice Earnings
Sci/Tech,Playboy Article May Raise Concerns for Google
Sci/Tech,Hacker Cracks Apple's Music Streaming Technology
Sci/Tech,Athens Wrestles to Avoid Cell Phone Outages
Sci/Tech,Battling Robots in Japan's Pop-Culture Tech
Sci/Tech,Minnesota Teen Pleads Guilty in Web Worm Hack Attack
Sci/Tech,REVIEW: Windows XP Battens Down Hatches in Latest Patch
Sci/Tech,Microsoft Unveils Windows XP 'Starter Edition'
Sci/Tech,Google Sets Date for IPO
Sci/Tech,321 Studios Reaches Settlement in DVD Copying Dispute
Sci/Tech,Microsoft Says Battle in Japan Hurting Image
Sci/Tech,Sharp Introduces 3-Dimensional Computer Display
Sci/Tech,Google to Give Yahoo More Stock to Settle Dispute
Sci/Tech,Unprecedented Electronic Digital Net for Olympics
Sci/Tech,Heat Turned Up on Streaming Video Patents
Sci/Tech,Help's on the Way for Bad Dates Via Cell Phone
Sci/Tech,Reading the Prospectus Critical to IPO Decisions
Sci/Tech,Search Engine Forums Spotlight
Sci/Tech,Another Expanded Whois Service
Sci/Tech,Capturing Your Personal Web
Sci/Tech,Yahoo Offers Anti-Spyware App
Sci/Tech,"Google, Yahoo Settle Patent and Share Disputes"
Sci/Tech,Search Engine Forums Spotlight
Sci/Tech,eBay Buys 25 of CraigList
Sci/Tech,Getting Around Search Engine Optimization Roadblocks
Sci/Tech,Search Engine Marketing Mistakes Retailers Need to Avoid
Sci/Tech,Does Playboy Interview Violate Google IPO?
Sci/Tech,Google IPO Bidding Opens
Sci/Tech,Claria Cancels \$150 million IPO
Sci/Tech,Google IPO Registration Ends Today
Sci/Tech,Thoughts on the Google IPO
Sci/Tech,Avoid Search Engine Blacklisting
Sci/Tech,Google Index Database to be Archived?
Sci/Tech,News: U.S. tackles Emergency Alert System insecurity
Sci/Tech,News: UK police issue 'vicious' Trojan alert
Sci/Tech,News: UK scientists roll out Wi-Fi proof wallpaper
Sci/Tech,"Infocus: Examining a Public Exploit, Part 1"
Sci/Tech,"Infocus: Deploying Network Access Quarantine Control, Part 1"
Sci/Tech,Infocus: Data Driven Attacks Using HTTP Tunneling
Sci/Tech,Infocus: Wireless Attacks and Penetration Testing (part 3 of 3)
Sci/Tech,Columnists: The Panacea of Information Security
Sci/Tech,Columnists: Redmond's Salvation
Sci/Tech,Elsewhere: Blaster B Virus Creator Pleads Guilty
Sci/Tech,Animating for the Super Bowl
Sci/Tech,Apple Ships Motion
Sci/Tech,Apple Introduces Production Suite
Sci/Tech,iTunes Music Store Catalog Tops One Million Songs
Sci/Tech,Technology as Fashion
Sci/Tech,Creating Stunning DVDs
Sci/Tech,Revolutionizing Flow Cytometry
Sci/Tech,PowerSchool University
Sci/Tech,Guitar Player Honors GarageBand
Sports,"Phelps, Thorpe Advance in 200 Freestyle (AP)"
Sports,Reds Knock Padres Out of Wild-Card Lead (AP)
Sports,"Dreaming done, NBA stars awaken to harsh Olympic reality (AFP)"
Sports,"Indians Beat Twins 7-1, Nearing AL Lead (AP)"
Sports,"Galaxy, Crew Play to 0-0 Tie (AP)"
Sports,"USC Begins Season Where It Ended, at No. 1 (AP)"
Sports,Italy's Pennetta Wins Idea Prokom Open (AP)
Sports,Tough Race Ahead for Swimmer Phelps
Sports,Iranian Will Not Meet Israeli in Olympics Due to Weight
Sports,Tiger Runs Out of Steam After Storming Start
Sports,Colander Misses Chance to Emulate Jones
Sports,AL Wrap: Olerud Cheers Yankees by Sinking Ex-Team
Sports,NL Wrap: Jones Homers Twice as Braves Down Cards
Sports,Olympics-Doping-Greek Media Put Country's Honor Above Athletes
Sports,Olympics-Rowing-U.S. Eight Beats Canada to Set World Best Time
Sports,"Singh Leads, but Leonard Is Following"
Sports,Olerud Bails Out Loaiza in His Latest Bungled Audition
Sports,Family circle
Sports,Notables
Sports,Cubs get delivery from Wood
Sports,Leskanic winning arms race
Sports,Rehabbing his career
Sports,Warmer and wilder
Sports,Greek runners are suspended
Sports,"Throwbacks: Gannon, Collins in good form"
Sports,Enough to make you flip
Sports,"For Revolution, this tie looks good"
Sports,Sing Me Back Home matches track mark
Sports,Haas in fine form
Sports,USC starts at the top
Sports,'Gardening' costs Appleby -- in spades
Sports,"Hungarian GP, Qualifying"
Sports,"Budapest, Free Practice 3 and 4: A tight battle in store"
Sports,Overtaking at Budapest? Its possible
Sports,"Budapest, Day 1: everythings on track"
Sports,"Hungarian GP, Friday Round-Up"
Sports,Redskins Get the Boot
Sports,Trojans Open Up No. 1
Sports,Offense Needs Work
Sports,Huey Exits Early
Sports,True Sensation Wins A Wet One at Pimlico
Sports,Lynx Infielder Fontenot Has 'Pretty Good Pop for His Size'
Sports,"Australia, U.S. Set Record"
Sports,Phelps On Relay Team
World,Venezuelans Vote Early in Referendum on Chavez Rule (Reuters)
World,S.Koreans Clash with Police on Iraq Troop Dispatch (Reuters)
World,Palestinians in Israeli Jails Start Hunger Strike (Reuters)
World,Seven Georgian soldiers wounded as South Ossetia ceasefire violated (AFP)
World,Rwandan Troops Arrive in Darfur (AP)
World,Rwanda Troops Airlifted to Start AU Mission in Darfur (Reuters)
World,Bomb at India Independence Parade Kills 15 (AP)
World,Australian FM to visit North Korea for talks on nuclear crisis (AFP)
World,Kerry Campaign Helping With Fla. Recovery (AP)
World,Edwards Calls for Changes to Drug Plans (AP)
World,Kerry leading Bush in key swing states (AFP)
World,Democratic Senator Urges Energy Reform (AP)
World,Missouri Attorney General Sues EPA (AP)
World,Mortars Mark Opening of Iraqi Political Conference
World,Japan Ministers Pay Homage at Shrine for War Dead
World,Najaf battle a crucial test for Allawi
World,Who are Ch #225;vez's opponents?
World,"Eye on Athens, China stresses a 'frugal' 2008 Olympics"
World,Tense Iraq debates new assembly
World,Venezuelans vote on Chavez rule
World,Pope celebrates Mass in Lourdes
World,Rwandan soldiers arrive in Sudan
World,Thorpe leads big guns
World,Mystery over judo 'protest'
World,Jackson probe 'should be public'
World,Rumsfeld warning for Iraq's Sadr
World,South Ossetia ceasefire discussed
